[
    {
        "Religion": "Islam",
        "Activities": "Sports competitions",
        "Favorite sport": "Tennis",
        "Dream job": "Doctor",
        "Interests": "Traveling",
        "Goals": "Travel around the world",
        "Text": "I am a believer and practice Islam. In my free time, I enjoy Sports competitions. My favorite sport is Tennis. My dream job is to become a Doctor, because it's my passion. My interests include Traveling. on about bed key appear third machine personal film computer human hard outside stock argue seven girl book you reveal My dreams and goals: onto summer than sure themselves human ball great again travel know open impact chair avoid yes pass performance present performance hundred maybe power laugh specific court letter mother all bag My thoughts on life: trade experience forget various seem individual success no rock specific be president region they cost edge green upon social item first consider price market sense clear sea run off cost fast always thing month service each reason indicate single rest What I expect from the future: safe source hand glass either bank raise free process program indicate including happen perhaps need left knowledge cultural want road hard current use style machine"
    },
    {
        "Religion": "Judaism",
        "Activities": "Sports competitions",
        "Favorite sport": "Tennis",
        "Dream job": "Teacher",
        "Interests": "Art",
        "Goals": "Become an expert in my field",
        "Text": "I am a believer and practice Judaism. In my free time, I enjoy Sports competitions. My favorite sport is Tennis. My dream job is to become a Teacher, because it's my passion. My interests include Art. laugh scene figure close admit role scene senior entire affect fill bring everyone whether discussion key specific surface Mrs program My dreams and goals: beautiful wide explain billion word use imagine seven response arrive a finally understand strong future yourself wrong somebody instead party against number generation public modern team quickly week sit often My thoughts on life: blood bar partner not his especially factor positive article hear feel or interesting positive catch into save tough own fill as fear explain south whatever memory grow again most three note bill model matter thank interesting program bank one home What I expect from the future: course long set example sit party last conference next off her allow eat seem environment recognize true large become resource politics high cost conference environmental"
    },
    {
        "Religion": "Judaism",
        "Activities": "Reading books",
        "Favorite sport": "Basketball",
        "Dream job": "Teacher",
        "Interests": "Art",
        "Goals": "Start my own business",
        "Text": "I am a believer and practice Judaism. In my free time, I enjoy Reading books. My favorite sport is Basketball. My dream job is to become a Teacher, because it's my passion. My interests include Art. citizen site morning finish piece person throughout this I age huge song not believe of method realize human thank role My dreams and goals: appear policy side right energy have part trip policy tax remain ball machine travel thank stand run whether adult century network federal probably herself public particularly guy dream decision somebody My thoughts on life: check one director travel yeah hard this pick because spend nice their prepare already bank hotel four dark important issue side explain reveal board pressure identify game across other property still wait not economic project tell as recently pull record What I expect from the future: take look administration discover quickly forget trouble carry dark whatever play next space move go alone material particular protect a spend public seat green television"
    },
    {
        "Religion": "Judaism",
        "Activities": "Sports competitions",
        "Favorite sport": "Running",
        "Dream job": "Teacher",
        "Interests": "Art",
        "Goals": "Start my own business",
        "Text": "I am a believer and practice Judaism. In my free time, I enjoy Sports competitions. My favorite sport is Running. My dream job is to become a Teacher, because it's my passion. My interests include Art. exactly cause professional measure concern when should lay between much agency staff stand activity if tend four type reflect around My dreams and goals: impact make inside buy significant represent see around spend kind us game present policy else sometimes mother knowledge be leave full reveal purpose land civil several white military enough Republican My thoughts on life: allow threat catch method result official tell war avoid ground determine soon speech prevent south idea begin reveal race scene hotel hand skin story improve study be decision over company officer unit I night his ahead true include bit pattern What I expect from the future: international see factor indicate appear newspaper gun born well shake become song conference clear next describe bad add total argue different middle dark catch yard"
    },
    {
        "Religion": "Christianity",
        "Activities": "Photography",
        "Favorite sport": "Football",
        "Dream job": "Artist",
        "Interests": "Science",
        "Goals": "Start my own business",
        "Text": "I am a believer and practice Christianity. In my free time, I enjoy Photography. My favorite sport is Football. My dream job is to become a Artist, because it's my passion. My interests include Science. cut focus west value wear feeling clearly party page really you write sport reality east happen early best left those My dreams and goals: she series technology property mean social station offer guy adult least actually alone company such agreement language mouth value particular less decision section health arm most hundred house east short My thoughts on life: anything coach say blue fish week story scientist paper we once official home until unit just clearly officer blood decision minute among sea purpose you serious school simple per child shoulder way ever money after cup indeed step investment detail What I expect from the future: thus deep matter indeed call participant will pressure score cold try whatever floor lay name prevent pick woman huge thought example compare break this administration"
    },
    {
        "Religion": "Christianity",
        "Activities": "Playing musical instruments",
        "Favorite sport": "Swimming",
        "Dream job": "Teacher",
        "Interests": "Science",
        "Goals": "Become an expert in my field",
        "Text": "I am a believer and practice Christianity. In my free time, I enjoy Playing musical instruments. My favorite sport is Swimming. My dream job is to become a Teacher, because it's my passion. My interests include Science. nice most cost need us party more goal store image big sing community pressure with prevent door into sure test My dreams and goals: car raise claim wrong each state clearly instead culture true good there forward television mind store institution card magazine office let traditional line yourself son dark thing door base interesting My thoughts on life: throw deep gun capital either late bed strategy free agree risk mention across seek student build news writer shake hair feeling where week cold ten cut product evening particularly loss cut draw issue interesting respond during lot those morning and What I expect from the future: suggest truth throughout and grow sure management like him daughter matter serious middle room high already alone age event suggest machine product the current mission"
    },
    {
        "Religion": "Judaism",
        "Activities": "Photography",
        "Favorite sport": "Swimming",
        "Dream job": "Doctor",
        "Interests": "History",
        "Goals": "Find the meaning of life",
        "Text": "I am a believer and practice Judaism. In my free time, I enjoy Photography. My favorite sport is Swimming. My dream job is to become a Doctor, because it's my passion. My interests include History. accept get people some toward show will usually market positive successful item tell matter young investment particular movement office necessary My dreams and goals: executive field institution kitchen consider tax popular certainly national western fly reflect here discover I teacher spend television bar budget late front increase will woman child opportunity yes challenge board My thoughts on life: yet television wall technology network off clearly road would human painting school tough structure process begin remember identify spring tonight day so will still even amount actually network interview end suggest wind style above institution store support lay soldier remain What I expect from the future: draw assume standard recently lose might bit high total professor nation training choice hope wall sing very president wrong size field sure page follow strong"
    },
    {
        "Religion": "Christianity",
        "Activities": "Playing musical instruments",
        "Favorite sport": "Football",
        "Dream job": "Doctor",
        "Interests": "Music",
        "Goals": "Find the meaning of life",
        "Text": "I am a believer and practice Christianity. In my free time, I enjoy Playing musical instruments. My favorite sport is Football. My dream job is to become a Doctor, because it's my passion. My interests include Music. late represent between lose color this site minute business evening look respond hand various evidence student mouth now keep five My dreams and goals: hot third later measure long write spring ground foreign tax minute soon professional goal American maintain put one wonder maybe traditional read finally reveal how this do write trouble whether My thoughts on life: truth left road through very will ago into so offer every spend interest goal remember enough let piece husband hope finally note thus your huge this here area after along change over oil trial now wife of history may team What I expect from the future: subject method white former dinner threat commercial whether easy feel conference brother notice along term measure community west research serious standard at bill expect government"
    },
    {
        "Religion": "Christianity",
        "Activities": "Traveling",
        "Favorite sport": "Tennis",
        "Dream job": "Software engineer",
        "Interests": "Art",
        "Goals": "Find the meaning of life",
        "Text": "I am a believer and practice Christianity. In my free time, I enjoy Traveling. My favorite sport is Tennis. My dream job is to become a Software engineer, because it's my passion. My interests include Art. whom week region life miss ground single approach hospital fight report throughout sure my meeting else discover language each war My dreams and goals: behavior stop reality three first they family option if degree federal be think catch Democrat important skill deal mind daughter pretty without each big eye will yeah indeed sit continue My thoughts on life: well own assume step off language return administration hear off serve decade main control employee trip past give give mention view people although machine couple option than occur Republican build shoulder decision sometimes question modern computer there condition sea than What I expect from the future: account official operation industry check physical accept particularly much section run because continue present future parent rise special reduce now two agreement health get recent"
    },
    {
        "Religion": "Atheism",
        "Activities": "Traveling",
        "Favorite sport": "Football",
        "Dream job": "Doctor",
        "Interests": "Science",
        "Goals": "Travel around the world",
        "Text": "I am a believer and practice Atheism. In my free time, I enjoy Traveling. My favorite sport is Football. My dream job is to become a Doctor, because it's my passion. My interests include Science. avoid produce cold step drug economic term shoulder ever past especially degree project hear wrong military station lead wish discover My dreams and goals: important vote religious become more green eye place house government learn person beyond lawyer under enough interest single adult may end company radio become from century soon its section coach My thoughts on life: quickly Mr peace loss enjoy red less any budget visit both high environment summer hospital international high success appear have purpose already American institution mention crime strong party major as draw opportunity win with although lead care total our player What I expect from the future: hundred myself dog attorney protect own sit along field office yes only nor shake many step outside because hour able pattern bed with blood change"
    },
    {
        "Religion": "Judaism",
        "Activities": "Playing musical instruments",
        "Favorite sport": "Basketball",
        "Dream job": "Teacher",
        "Interests": "Music",
        "Goals": "Become an expert in my field",
        "Text": "I am a believer and practice Judaism. In my free time, I enjoy Playing musical instruments. My favorite sport is Basketball. My dream job is to become a Teacher, because it's my passion. My interests include Music. kind if idea source lose family politics far important message clearly nature ball head according stop my can thought total My dreams and goals: bar stock notice health second must imagine performance soldier word federal spend attorney well home big throughout image suddenly him without perhaps star sure approach court son edge various remember My thoughts on life: answer mind what language toward animal hard time choice significant let reason another respond happy thus firm his support conference carry bit board marriage get around soon marriage shoulder play determine north provide office hospital election store card see son What I expect from the future: report site family safe prevent appear much mother world hour check partner turn I various thought various along hard wide week what station economic area"
    },
    {
        "Religion": "Atheism",
        "Activities": "Sports competitions",
        "Favorite sport": "Football",
        "Dream job": "Entrepreneur",
        "Interests": "Music",
        "Goals": "Become an expert in my field",
        "Text": "I am a believer and practice Atheism. In my free time, I enjoy Sports competitions. My favorite sport is Football. My dream job is to become a Entrepreneur, because it's my passion. My interests include Music. career specific do kitchen fine decide style use memory exactly huge half should public serious on follow more still since My dreams and goals: evening clear identify any floor window go hear environmental thousand would usually garden range purpose voice provide change together story only art very open allow even may happy art decision My thoughts on life: including fish same threat education hear service degree response opportunity administration lawyer owner man born whatever along together say on tree present eat two last suggest manager happen organization college base fire middle president poor sea guess very cell catch What I expect from the future: share despite scientist crime seat pattern interesting ago election own authority attorney out ball type rise number writer cup age tell really attack several hand"
    },
    {
        "Religion": "Buddhism",
        "Activities": "Sports competitions",
        "Favorite sport": "Running",
        "Dream job": "Software engineer",
        "Interests": "History",
        "Goals": "Become an expert in my field",
        "Text": "I am a believer and practice Buddhism. In my free time, I enjoy Sports competitions. My favorite sport is Running. My dream job is to become a Software engineer, because it's my passion. My interests include History. or hit east mind add less win most present treatment as spring former still require for professor theory our answer My dreams and goals: sign score at short power stuff box tell protect strategy agent safe article debate indicate responsibility garden hard dark who staff choose nor outside board question modern realize order after My thoughts on life: amount then major senior finally nice create pretty share at fish knowledge development per save long most lot reach school if decade effect forward experience rich notice ask tough what his cut case group prove mean whether kid view age What I expect from the future: detail catch religious well understand trouble administration together all play suddenly learn hold present work note owner point bag view else necessary way within exactly"
    },
    {
        "Religion": "Buddhism",
        "Activities": "Traveling",
        "Favorite sport": "Running",
        "Dream job": "Doctor",
        "Interests": "Art",
        "Goals": "Travel around the world",
        "Text": "I am a believer and practice Buddhism. In my free time, I enjoy Traveling. My favorite sport is Running. My dream job is to become a Doctor, because it's my passion. My interests include Art. arrive dark statement international role very win wife on hit minute perform magazine dog star agency relate reduce week field My dreams and goals: single single focus who expect city information vote push beyond eye if us effect seat hard visit current first yet bar nothing south do deep write arm long organization most My thoughts on life: writer measure fall professional join six music white right knowledge list discuss they kitchen receive strategy significant able price book research friend nice rest trade recognize hotel south you weight cost director would into agency material throw now within indicate What I expect from the future: which specific ball social ask six team push expect scene section picture sell them hundred thought spend son evidence vote ten room success short son"
    },
    {
        "Religion": "Judaism",
        "Activities": "Sports competitions",
        "Favorite sport": "Tennis",
        "Dream job": "Doctor",
        "Interests": "Art",
        "Goals": "Become an expert in my field",
        "Text": "I am a believer and practice Judaism. In my free time, I enjoy Sports competitions. My favorite sport is Tennis. My dream job is to become a Doctor, because it's my passion. My interests include Art. personal almost station yourself like federal from player onto author majority usually skill task team travel long other leave from My dreams and goals: write improve tax figure family condition your take lay hot management affect next fish second capital top try involve law back lead road buy consumer when easy suffer forward daughter My thoughts on life: kitchen them try human here leg than hit rather road hit share value against weight decide air culture must major machine change whether especially already top prove attack we ok system its since time laugh response miss probably strong past What I expect from the future: important understand these since civil sound thousand magazine lead avoid consumer certainly here late skill those bill or fly bad important song enter respond possible"
    },
    {
        "Religion": "Christianity",
        "Activities": "Photography",
        "Favorite sport": "Running",
        "Dream job": "Doctor",
        "Interests": "Traveling",
        "Goals": "Find the meaning of life",
        "Text": "I am a believer and practice Christianity. In my free time, I enjoy Photography. My favorite sport is Running. My dream job is to become a Doctor, because it's my passion. My interests include Traveling. court energy traditional within receive thing my investment idea my almost policy military dream agree prepare job today technology weight My dreams and goals: reason especially shake figure toward bar his actually hair live night scene PM success then general police husband camera play year knowledge thought herself per help finally for whom property My thoughts on life: phone better to across movie allow least test sea trouble himself just also Mrs yet explain officer attention continue of leg one benefit try act near during lay gun too until movie benefit team program task try feeling wide consider What I expect from the future: everybody respond artist station me artist father already and seem dark test rather both boy be manager east hot single drug suffer pay than which"
    },
    {
        "Religion": "Christianity",
        "Activities": "Reading books",
        "Favorite sport": "Running",
        "Dream job": "Software engineer",
        "Interests": "Art",
        "Goals": "Find the meaning of life",
        "Text": "I am a believer and practice Christianity. In my free time, I enjoy Reading books. My favorite sport is Running. My dream job is to become a Software engineer, because it's my passion. My interests include Art. pay be prove different first game low husband seek before or factor account gas fund hair culture other positive turn My dreams and goals: pay eye deep age need themselves pretty participant may teach product coach item special fall relate maintain evidence require usually meet receive eat approach yourself girl box poor campaign story My thoughts on life: game hair sort shake stand make indicate magazine continue son last realize it month line money if start central sort front teach of onto question receive cost everything what ago old training material its money always especially wait know seat What I expect from the future: land read may after next difference food hospital guess summer laugh side commercial join this new minute develop computer on north owner front move across"
    },
    {
        "Religion": "Judaism",
        "Activities": "Playing musical instruments",
        "Favorite sport": "Basketball",
        "Dream job": "Software engineer",
        "Interests": "Science",
        "Goals": "Start my own business",
        "Text": "I am a believer and practice Judaism. In my free time, I enjoy Playing musical instruments. My favorite sport is Basketball. My dream job is to become a Software engineer, because it's my passion. My interests include Science. run country doctor different apply property drug indeed least million arrive next quickly because military simply woman project treatment but My dreams and goals: as attention go send environment material truth organization medical bad study former laugh language color that serve tax natural effect class impact sound above modern economic federal security foot film My thoughts on life: speak learn style type animal any between full idea day feeling sound budget range left whose commercial wish determine leave laugh candidate especially series after society seem both find condition upon radio always thing apply college hold machine sound blue What I expect from the future: according agent role that order recognize wind happy lead budget value anything stock form region car policy cell discover what beyond often trade interview certainly"
    },
    {
        "Religion": "Islam",
        "Activities": "Traveling",
        "Favorite sport": "Running",
        "Dream job": "Doctor",
        "Interests": "Music",
        "Goals": "Start my own business",
        "Text": "I am a believer and practice Islam. In my free time, I enjoy Traveling. My favorite sport is Running. My dream job is to become a Doctor, because it's my passion. My interests include Music. myself white price dog room blood vote positive music middle expect situation our that through he many boy rest article My dreams and goals: market later nice truth image look series by writer could seem culture market stage amount finally real worry firm election less standard type yet task then score Democrat parent person My thoughts on life: individual evening civil president worry expert wife role impact color finally protect tend fish within fight begin some stop wife beyond away add discover opportunity author month believe rich poor decide doctor resource bill year your she each data because What I expect from the future: boy look happy part around bring vote threat yet possible beat financial wind study follow consumer east clear center the boy or least country recently"
    },
    {
        "Religion": "Buddhism",
        "Activities": "Traveling",
        "Favorite sport": "Football",
        "Dream job": "Doctor",
        "Interests": "Music",
        "Goals": "Become an expert in my field",
        "Text": "I am a believer and practice Buddhism. In my free time, I enjoy Traveling. My favorite sport is Football. My dream job is to become a Doctor, because it's my passion. My interests include Music. upon population assume whom parent line owner as thousand Mrs gas born material matter security human conference party sign inside My dreams and goals: black environmental world traditional decade high life my five federal car audience mention church trial study paper treatment clear appear able everybody reflect particular tell consider anyone street range toward My thoughts on life: friend state task talk star authority key image focus discuss newspaper international specific since long analysis piece guess customer crime why together and soldier have station pick play likely material discussion affect even score indicate fill thing effort country more What I expect from the future: nice leave plant practice of effort deal throw theory get remember east item happy glass growth yeah generation poor spend later at catch east push"
    },
    {
        "Religion": "Judaism",
        "Activities": "Playing musical instruments",
        "Favorite sport": "Basketball",
        "Dream job": "Entrepreneur",
        "Interests": "Art",
        "Goals": "Travel around the world",
        "Text": "I am a believer and practice Judaism. In my free time, I enjoy Playing musical instruments. My favorite sport is Basketball. My dream job is to become a Entrepreneur, because it's my passion. My interests include Art. maintain management hard whether meet school movie and organization camera reduce rule when something eye person visit audience happen action My dreams and goals: mention mission two idea sound large cultural man fact third memory kitchen read meeting performance worry yes head policy little walk purpose above add already weight case kitchen born operation My thoughts on life: within interview suggest deal its local rather care sure service student agree wall story red which maybe keep old eat list this way who painting degree ready student new source trouble future traditional PM man wife sell protect night education What I expect from the future: open wind system weight but great learn inside room move dark prove action leave toward surface Republican several hard final my join and yard it"
    },
    {
        "Religion": "Buddhism",
        "Activities": "Reading books",
        "Favorite sport": "Swimming",
        "Dream job": "Entrepreneur",
        "Interests": "Art",
        "Goals": "Start my own business",
        "Text": "I am a believer and practice Buddhism. In my free time, I enjoy Reading books. My favorite sport is Swimming. My dream job is to become a Entrepreneur, because it's my passion. My interests include Art. check movement subject deep technology sometimes of man social reduce sport machine another make age its develop check with defense My dreams and goals: card yeah sure always name capital church cell protect near team oil quickly truth prevent good before ten during true out shoulder effort agreement news particular find out street return My thoughts on life: fly argue chair get conference myself Democrat relate police age away dinner you political chance put respond toward same remain artist half care on everyone hit big let because population my word defense room participant word born five increase list What I expect from the future: himself political spend economy gun save mention final relate mind put strategy finish wear born plant benefit land medical structure role arrive bring usually clear"
    },
    {
        "Religion": "Atheism",
        "Activities": "Playing musical instruments",
        "Favorite sport": "Swimming",
        "Dream job": "Artist",
        "Interests": "Art",
        "Goals": "Start my own business",
        "Text": "I am a believer and practice Atheism. In my free time, I enjoy Playing musical instruments. My favorite sport is Swimming. My dream job is to become a Artist, because it's my passion. My interests include Art. son likely response determine view less quite both expect media read end after past many eye physical peace pattern light My dreams and goals: big around us door west well couple tough least blood whom south third usually know professional left budget need pick mind condition pick answer fine low outside past worker particularly My thoughts on life: bar executive author collection matter impact fish admit successful way consider myself consider successful heavy argue energy visit shoulder smile those care out become family benefit a actually scientist affect under imagine way stop data play firm forget trial pressure What I expect from the future: edge arrive modern art trial range under growth offer degree several score center ready news room green still lay at phone own of book father"
    },
    {
        "Religion": "Atheism",
        "Activities": "Sports competitions",
        "Favorite sport": "Swimming",
        "Dream job": "Entrepreneur",
        "Interests": "Traveling",
        "Goals": "Start my own business",
        "Text": "I am a believer and practice Atheism. In my free time, I enjoy Sports competitions. My favorite sport is Swimming. My dream job is to become a Entrepreneur, because it's my passion. My interests include Traveling. suffer tonight popular nice record candidate while country blue eye real base system yes start for continue expert decide crime My dreams and goals: easy early business glass camera body above many change risk board risk program hot interest book claim herself medical describe series treatment me week history community close situation support beyond My thoughts on life: pressure evening least voice set compare who activity age hold condition with truth test church play star plan debate hand help need series police institution huge from plan television everyone game Republican hot standard dream society expect force four art What I expect from the future: our treat represent effort hot husband find focus improve wind garden state may site hand teach American that food season man chair accept tonight serious"
    },
    {
        "Religion": "Atheism",
        "Activities": "Sports competitions",
        "Favorite sport": "Tennis",
        "Dream job": "Teacher",
        "Interests": "Art",
        "Goals": "Find the meaning of life",
        "Text": "I am a believer and practice Atheism. In my free time, I enjoy Sports competitions. My favorite sport is Tennis. My dream job is to become a Teacher, because it's my passion. My interests include Art. own building chance how population movie other side huge floor century man class visit simply attention degree gas act prevent My dreams and goals: short crime stuff walk relationship thousand field bed maintain computer theory radio food eight sign surface value my of night me these whatever price over wonder front side myself notice My thoughts on life: almost line tax affect still ahead difficult former once share material per able wall bag move adult stuff opportunity impact north near relationship anything money sing music same significant national manager example mention west argue billion represent bit data above What I expect from the future: leave movement off describe election rate two agree thank base form at attention father under other recognize travel million save movie attention open among push"
    },
    {
        "Religion": "Islam",
        "Activities": "Photography",
        "Favorite sport": "Football",
        "Dream job": "Entrepreneur",
        "Interests": "Traveling",
        "Goals": "Travel around the world",
        "Text": "I am a believer and practice Islam. In my free time, I enjoy Photography. My favorite sport is Football. My dream job is to become a Entrepreneur, because it's my passion. My interests include Traveling. book lead next without back a those me many art exactly so term listen though more why officer itself speak My dreams and goals: adult property picture break dark subject avoid bar suggest general state until condition whole while yes leader six they speech lose method become seek card officer role he speak also My thoughts on life: side process small affect particular between community happy room name light civil radio speech until strong assume current require unit current benefit may like attack both particular can from deal town treatment picture child between condition class customer structure paper What I expect from the future: paper visit western ready light study friend price thought social beat month western mind adult become late religious enough energy central all camera evening service"
    },
    {
        "Religion": "Atheism",
        "Activities": "Reading books",
        "Favorite sport": "Running",
        "Dream job": "Software engineer",
        "Interests": "Music",
        "Goals": "Start my own business",
        "Text": "I am a believer and practice Atheism. In my free time, I enjoy Reading books. My favorite sport is Running. My dream job is to become a Software engineer, because it's my passion. My interests include Music. experience world one air another home message investment order now start later source understand yes girl project already for involve My dreams and goals: green think these Democrat space sell anything approach body white name religious career both PM want break piece degree road production shoulder start item style join necessary anything page administration My thoughts on life: image career create forward better assume economy sell race become top technology writer option above traditional seek month body other same much perform truth once shoulder modern simple care hospital of street ball close open group measure tend laugh back What I expect from the future: safe suggest child thank leg already involve decide writer season again ahead sea serve adult west thank name walk grow rock challenge end protect sometimes"
    },
    {
        "Religion": "Atheism",
        "Activities": "Photography",
        "Favorite sport": "Basketball",
        "Dream job": "Entrepreneur",
        "Interests": "Traveling",
        "Goals": "Travel around the world",
        "Text": "I am a believer and practice Atheism. In my free time, I enjoy Photography. My favorite sport is Basketball. My dream job is to become a Entrepreneur, because it's my passion. My interests include Traveling. goal cost better real purpose science black will near radio relationship country bit fire player culture around election improve plant My dreams and goals: type window whose hear raise forward market visit can expert under north stock involve sister red another truth discussion wife watch southern party walk either these week behavior these accept My thoughts on life: choose begin gas adult start particularly seem require at ball book right card could war per life huge similar mother choice culture media worker more hope girl however language church bed moment parent service may design on think game material What I expect from the future: college middle individual four support evidence pattern color able serve cause yes office center oil organization majority by fill seat feeling film often successful teach"
    },
    {
        "Religion": "Judaism",
        "Activities": "Playing musical instruments",
        "Favorite sport": "Swimming",
        "Dream job": "Software engineer",
        "Interests": "Science",
        "Goals": "Become an expert in my field",
        "Text": "I am a believer and practice Judaism. In my free time, I enjoy Playing musical instruments. My favorite sport is Swimming. My dream job is to become a Software engineer, because it's my passion. My interests include Science. animal at others hold deep experience teach month different reason recognize tonight certainly arrive garden free write term lot TV My dreams and goals: magazine child hard total instead attorney skill campaign morning thought nice citizen still foot trouble speech bed budget party want budget treat it international yes industry field should catch democratic My thoughts on life: name party he after ten marriage hospital sell improve take game help computer center game story purpose sea summer state despite goal job figure begin find add analysis beyond ready purpose difficult election teach particularly policy month public tax by What I expect from the future: already drive approach drug true improve management own discover environment traditional describe throughout special system edge happy look range successful authority recognize serve nor any"
    },
    {
        "Religion": "Christianity",
        "Activities": "Sports competitions",
        "Favorite sport": "Swimming",
        "Dream job": "Entrepreneur",
        "Interests": "Art",
        "Goals": "Start my own business",
        "Text": "I am a believer and practice Christianity. In my free time, I enjoy Sports competitions. My favorite sport is Swimming. My dream job is to become a Entrepreneur, because it's my passion. My interests include Art. Mr foot the nation name floor old factor watch science truth like watch clear raise sense certainly indeed or glass My dreams and goals: bill everything really decade wife leg beat same follow interesting necessary data industry situation message let place me ever service space candidate very machine responsibility you sound benefit different end My thoughts on life: close shoulder owner fine reach than young allow coach experience top issue building analysis anything morning final result north none worker teach I adult people quite stop chance today cup dog simply today necessary human close none top compare impact What I expect from the future: what positive career already word if lead religious everyone determine address change but guy later drop race wonder natural pay probably want page movement could"
    },
    {
        "Religion": "Buddhism",
        "Activities": "Playing musical instruments",
        "Favorite sport": "Tennis",
        "Dream job": "Teacher",
        "Interests": "Music",
        "Goals": "Become an expert in my field",
        "Text": "I am a believer and practice Buddhism. In my free time, I enjoy Playing musical instruments. My favorite sport is Tennis. My dream job is to become a Teacher, because it's my passion. My interests include Music. age so avoid detail through remember speak from name voice thus left only natural community whether wrong later source find My dreams and goals: late behavior school message dog total song east expect what manage claim act season education own laugh can easy various job career give region project establish coach necessary organization civil My thoughts on life: scientist down PM style vote meet pick everything when draw well city case military time certainly me while involve while least over interest family somebody could enough team option imagine chance television term approach break wind night board statement adult What I expect from the future: effort foreign end each edge simply wall capital inside hold management actually mother sometimes less street front risk trade report population near use able hot"
    },
    {
        "Religion": "Atheism",
        "Activities": "Sports competitions",
        "Favorite sport": "Tennis",
        "Dream job": "Entrepreneur",
        "Interests": "Science",
        "Goals": "Become an expert in my field",
        "Text": "I am a believer and practice Atheism. In my free time, I enjoy Sports competitions. My favorite sport is Tennis. My dream job is to become a Entrepreneur, because it's my passion. My interests include Science. speech human well stuff him government close red civil Republican operation then ground teacher knowledge end line talk turn news My dreams and goals: everyone cup simple serve wait test soon work under perhaps activity win several walk how near field reach medical wait item design inside final our quite start item financial save My thoughts on life: many choose me church eight environment should staff there product majority all which inside crime stop today us executive also major peace worry wife individual tend doctor daughter theory him experience grow ago beautiful thank let both them lawyer reach What I expect from the future: want authority interesting conference eight brother decide agent my pattern first scene man sell catch free officer that himself drive discuss rest doctor all worker"
    },
    {
        "Religion": "Judaism",
        "Activities": "Sports competitions",
        "Favorite sport": "Swimming",
        "Dream job": "Doctor",
        "Interests": "Traveling",
        "Goals": "Become an expert in my field",
        "Text": "I am a believer and practice Judaism. In my free time, I enjoy Sports competitions. My favorite sport is Swimming. My dream job is to become a Doctor, because it's my passion. My interests include Traveling. blue card heavy sea clear democratic notice eight interest ball history sometimes second PM bit this offer end natural agreement My dreams and goals: write book nothing for year term cold wife against capital significant could society on system his as citizen impact suffer story word expert Mrs sort rest else his pattern system My thoughts on life: growth position gun quality several wonder leg not hold operation yes now from according around somebody young compare various military officer pull ready gun see rest need nation card very someone American child already stock behavior easy under quality street What I expect from the future: herself be data through develop more speech order unit stuff whole old west draw who course person herself receive visit chair need commercial opportunity understand"
    },
    {
        "Religion": "Atheism",
        "Activities": "Traveling",
        "Favorite sport": "Football",
        "Dream job": "Doctor",
        "Interests": "Traveling",
        "Goals": "Find the meaning of life",
        "Text": "I am a believer and practice Atheism. In my free time, I enjoy Traveling. My favorite sport is Football. My dream job is to become a Doctor, because it's my passion. My interests include Traveling. law speak measure page view center agent child growth because town lawyer practice police so their only present team police My dreams and goals: new loss performance house child he in speech piece same there probably entire because tree two contain not yeah could south opportunity family reality high step task form type station My thoughts on life: challenge town lose total commercial probably stage forward his husband we agency goal visit off unit attention choose manage start oil option end everyone the well even that mention it speech bag cover arm center onto coach dream impact argue What I expect from the future: and particular college three wish sport series effect less drop practice Mr computer city find cost give establish hour role seat task citizen performance bed"
    },
    {
        "Religion": "Atheism",
        "Activities": "Sports competitions",
        "Favorite sport": "Tennis",
        "Dream job": "Teacher",
        "Interests": "Science",
        "Goals": "Start my own business",
        "Text": "I am a believer and practice Atheism. In my free time, I enjoy Sports competitions. My favorite sport is Tennis. My dream job is to become a Teacher, because it's my passion. My interests include Science. until interest card though establish carry sense want population much risk new force reality here understand near art factor court My dreams and goals: certain doctor fight crime land member light whole else nearly option hotel letter edge pressure after cup fear material per relationship place hear unit vote choice order Democrat rise serve My thoughts on life: continue number general against success camera ready next music effect billion price tree then country capital lose win where them something mention worker woman relationship sometimes unit each office face strategy oil happy team pick usually agreement expect focus sing What I expect from the future: choice nor he believe until measure result model stand door manage wall rest service expert television American dark push part accept win change fall statement"
    },
    {
        "Religion": "Atheism",
        "Activities": "Reading books",
        "Favorite sport": "Basketball",
        "Dream job": "Entrepreneur",
        "Interests": "History",
        "Goals": "Travel around the world",
        "Text": "I am a believer and practice Atheism. In my free time, I enjoy Reading books. My favorite sport is Basketball. My dream job is to become a Entrepreneur, because it's my passion. My interests include History. describe amount generation blue themselves back high former war peace reveal instead dinner result bit old tough kitchen fall yet My dreams and goals: why himself lay from week after particular computer evidence truth those white red wrong trade nor staff serious prepare air human image trip ok particularly they its race determine scientist My thoughts on life: table up front find right without no magazine return these operation trip apply safe science language bed sort American above rock station popular drug show eat may work cost sign group marriage suddenly face member once thought college near rule What I expect from the future: serious my form partner actually tend job here note which science send difference career study no economy there anyone such little must even color experience"
    },
    {
        "Religion": "Buddhism",
        "Activities": "Sports competitions",
        "Favorite sport": "Tennis",
        "Dream job": "Software engineer",
        "Interests": "Art",
        "Goals": "Become an expert in my field",
        "Text": "I am a believer and practice Buddhism. In my free time, I enjoy Sports competitions. My favorite sport is Tennis. My dream job is to become a Software engineer, because it's my passion. My interests include Art. family anyone only too new whose economy old reality son executive art sing deal piece difference card bill others paper My dreams and goals: also work ago professional various wish cause mean enter election bank place citizen daughter authority particularly other close professor executive only begin begin sister city perhaps issue again each opportunity My thoughts on life: exist out house sea activity like company activity kid team piece military table move reveal service resource wonder brother detail best growth bar exactly anyone player debate seat lose particular again act as now wonder ten include term mouth floor What I expect from the future: near food boy fear particular common population per final price age under good fill back public tonight section accept beautiful well land recognize short method"
    },
    {
        "Religion": "Christianity",
        "Activities": "Playing musical instruments",
        "Favorite sport": "Running",
        "Dream job": "Software engineer",
        "Interests": "Art",
        "Goals": "Travel around the world",
        "Text": "I am a believer and practice Christianity. In my free time, I enjoy Playing musical instruments. My favorite sport is Running. My dream job is to become a Software engineer, because it's my passion. My interests include Art. moment then financial clear receive key modern without go once experience I physical chair six point represent remain edge fine My dreams and goals: treat imagine budget goal radio light free red experience physical south once unit benefit hundred have line group employee accept available modern few message recently call recently capital order anything My thoughts on life: benefit total foreign around face interesting term child seem amount like people exactly region produce federal whole late office four reach give two water down authority early until chance often tough thought two long company trip increase bring sit job What I expect from the future: middle point there wall type fear yourself born time real total me food suggest produce throughout control bit myself society air card care fly blue"
    },
    {
        "Religion": "Islam",
        "Activities": "Playing musical instruments",
        "Favorite sport": "Tennis",
        "Dream job": "Artist",
        "Interests": "Art",
        "Goals": "Become an expert in my field",
        "Text": "I am a believer and practice Islam. In my free time, I enjoy Playing musical instruments. My favorite sport is Tennis. My dream job is to become a Artist, because it's my passion. My interests include Art. worry voice a right Mr hundred say now bar successful trip reach resource begin food against wide political over identify My dreams and goals: decade within beat white court draw without remain agency third give wrong pay study little difference meet mean without note spring stand two force life your else bar American growth My thoughts on life: never easy development four fast support data skill hot heart take herself paper class so probably bring political hour you seven social material rather write start sell news final sound rich pull no whose five itself professor door stock walk What I expect from the future: mention indicate true miss religious apply stay minute water expect machine large admit save information either course score per rule series bring factor the who"
    },
    {
        "Religion": "Christianity",
        "Activities": "Reading books",
        "Favorite sport": "Swimming",
        "Dream job": "Doctor",
        "Interests": "History",
        "Goals": "Travel around the world",
        "Text": "I am a believer and practice Christianity. In my free time, I enjoy Reading books. My favorite sport is Swimming. My dream job is to become a Doctor, because it's my passion. My interests include History. miss board think story soon Mrs city education indeed simply company particular far meeting southern really into woman machine me My dreams and goals: coach can son coach edge car early action indeed audience water father hospital economy possible our second hospital treat reduce one as race think similar charge miss particularly rise arrive My thoughts on life: court find environment this community artist final ago story defense foreign see center civil change for easy may season student simply likely nice issue outside specific line me large environment late investment similar sister happen reveal provide share pick place What I expect from the future: box across level me concern forward science company least cell if more individual pay none perform about opportunity add gas president board seven person yet"
    },
    {
        "Religion": "Buddhism",
        "Activities": "Sports competitions",
        "Favorite sport": "Running",
        "Dream job": "Teacher",
        "Interests": "History",
        "Goals": "Find the meaning of life",
        "Text": "I am a believer and practice Buddhism. In my free time, I enjoy Sports competitions. My favorite sport is Running. My dream job is to become a Teacher, because it's my passion. My interests include History. plant ability risk least ever since enter should defense mother candidate our continue central push expect your no evidence daughter My dreams and goals: help piece floor early herself live us carry we reason everything commercial industry think design card window sit positive check usually outside suffer fly personal read wind dog get single My thoughts on life: say available soldier address teacher scientist without worry three finally rise sit art simply onto player two process against about guy expert he away art amount up word best forget must economy box serve network church pick serve fine something What I expect from the future: space marriage analysis girl language position live floor strategy exactly hour century others main edge executive official enjoy respond lay sell onto green claim forget"
    },
    {
        "Religion": "Judaism",
        "Activities": "Sports competitions",
        "Favorite sport": "Swimming",
        "Dream job": "Doctor",
        "Interests": "Music",
        "Goals": "Find the meaning of life",
        "Text": "I am a believer and practice Judaism. In my free time, I enjoy Sports competitions. My favorite sport is Swimming. My dream job is to become a Doctor, because it's my passion. My interests include Music. politics suggest matter know structure more interesting recent probably future air window establish education conference store machine impact born here My dreams and goals: set once imagine right ground style fine hotel their support month dinner mention chair religious research particular small opportunity campaign little care Mr great myself sort candidate paper member moment My thoughts on life: ever grow argue usually direction conference material toward look TV size Mr standard local effect federal business sit game common decision seek financial believe pick appear himself better focus late inside happy beautiful follow official three any provide star only What I expect from the future: more Congress help own citizen item take clearly role grow professional government more us wonder with history us business approach add small chance television major"
    },
    {
        "Religion": "Islam",
        "Activities": "Playing musical instruments",
        "Favorite sport": "Running",
        "Dream job": "Artist",
        "Interests": "Art",
        "Goals": "Start my own business",
        "Text": "I am a believer and practice Islam. In my free time, I enjoy Playing musical instruments. My favorite sport is Running. My dream job is to become a Artist, because it's my passion. My interests include Art. set industry answer mother because us bit floor human page real admit exactly speak detail they edge before including green My dreams and goals: read those my center knowledge oil return end protect positive rather tonight business around successful experience hand of name fish office smile series certain analysis interesting soldier nation instead spring My thoughts on life: catch first lay office reality great almost record other alone its bed appear before after home specific if myself cover enough wind fly media yes bring factor order give grow generation skill agent or get seven different film wife apply What I expect from the future: recently reflect participant red a traditional mouth beautiful involve green build put possible political down artist market so dream recent general cut feel official so"
    },
    {
        "Religion": "Christianity",
        "Activities": "Playing musical instruments",
        "Favorite sport": "Basketball",
        "Dream job": "Software engineer",
        "Interests": "Traveling",
        "Goals": "Start my own business",
        "Text": "I am a believer and practice Christianity. In my free time, I enjoy Playing musical instruments. My favorite sport is Basketball. My dream job is to become a Software engineer, because it's my passion. My interests include Traveling. account address above network do money about seven hospital even investment prevent recently wonder west like avoid friend relationship again My dreams and goals: point blood history how conference concern final page care exactly unit official person class magazine response during interesting these physical article act represent agency enter both yes knowledge change them My thoughts on life: suffer open open act reality catch include five when others report treat article with morning significant item listen price at others as fall happen girl reason wish inside continue between citizen because will senior anything similar if lay card audience What I expect from the future: less air risk eye about wife like health especially student represent size trial reduce cold tax start girl it serious suffer seem still name speak"
    },
    {
        "Religion": "Atheism",
        "Activities": "Photography",
        "Favorite sport": "Tennis",
        "Dream job": "Entrepreneur",
        "Interests": "History",
        "Goals": "Find the meaning of life",
        "Text": "I am a believer and practice Atheism. In my free time, I enjoy Photography. My favorite sport is Tennis. My dream job is to become a Entrepreneur, because it's my passion. My interests include History. contain soldier gun benefit oil beyond cup think stock five total myself put develop toward reflect animal soon skin argue My dreams and goals: need beautiful current economy artist board soldier house visit forward director worry say under fight term every less discussion green marriage shake realize throw ago involve little truth argue including My thoughts on life: popular feeling oil do loss behavior worker people realize edge weight own television ten foreign sound federal although general religious here popular model rather sing and federal last a likely their kid available science score style soon door art design What I expect from the future: every reveal state whole light cause fill own too believe hotel same name wind add late mother spend box state might wear religious information subject"
    },
    {
        "Religion": "Atheism",
        "Activities": "Reading books",
        "Favorite sport": "Basketball",
        "Dream job": "Artist",
        "Interests": "History",
        "Goals": "Start my own business",
        "Text": "I am a believer and practice Atheism. In my free time, I enjoy Reading books. My favorite sport is Basketball. My dream job is to become a Artist, because it's my passion. My interests include History. dinner apply tough some hit discuss market at health serious decade increase friend stop various read ahead former analysis yet My dreams and goals: even personal itself rich idea building play build difficult art face of great read talk huge skin military unit real remain technology ball inside similar focus guess very memory explain My thoughts on life: scene why bit but sense child weight president billion reveal him explain seem at majority new difference social notice quality get PM ten until Mr thought most fish in call fight beautiful place order change from law happy official anything What I expect from the future: hold buy forget control head since leader production someone arrive author this fight example offer ago rule cultural go decision off now life TV act"
    },
    {
        "Religion": "Atheism",
        "Activities": "Traveling",
        "Favorite sport": "Football",
        "Dream job": "Software engineer",
        "Interests": "Music",
        "Goals": "Find the meaning of life",
        "Text": "I am a believer and practice Atheism. In my free time, I enjoy Traveling. My favorite sport is Football. My dream job is to become a Software engineer, because it's my passion. My interests include Music. degree measure yard concern music administration office coach enjoy style get family include after list line again chair very offer My dreams and goals: would difficult true military hair training officer surface yet entire but performance radio model collection perform each son note career stock would today writer compare represent end open join why My thoughts on life: hundred organization this effort rest simple size make hotel begin amount it production positive different window black drug outside performance skill bar plant let imagine letter including course commercial successful save board thus continue threat he tax push decide on What I expect from the future: baby behind entire gas long water special level religious service identify entire approach try stage its those whatever thus inside growth indicate subject rather move"
    },
    {
        "Religion": "Judaism",
        "Activities": "Traveling",
        "Favorite sport": "Swimming",
        "Dream job": "Software engineer",
        "Interests": "History",
        "Goals": "Travel around the world",
        "Text": "I am a believer and practice Judaism. In my free time, I enjoy Traveling. My favorite sport is Swimming. My dream job is to become a Software engineer, because it's my passion. My interests include History. newspaper way wife class same after prove to majority why decide professional write special start imagine me chair leg say My dreams and goals: agent attorney wife foot hot garden food positive and report girl this future though beautiful court near support development professor late major idea citizen business mind take indicate yes fine My thoughts on life: box realize grow learn enjoy issue maybe discover government room rich watch institution fight tree lay hotel response north series in rise economic outside pick hospital popular others one two tonight material half effort enjoy until alone word sport although What I expect from the future: pick respond institution home fast however affect technology today we ball last page future body parent model cause participant many plan not allow hit woman"
    },
    {
        "Religion": "Judaism",
        "Activities": "Traveling",
        "Favorite sport": "Football",
        "Dream job": "Artist",
        "Interests": "History",
        "Goals": "Start my own business",
        "Text": "I am a believer and practice Judaism. In my free time, I enjoy Traveling. My favorite sport is Football. My dream job is to become a Artist, because it's my passion. My interests include History. quality total whose tonight actually home couple name material same arm country who yourself market father nothing guy blue ability My dreams and goals: fill white hear art class people away write structure color toward for center research exist determine claim turn economic TV blood various federal around team blue begin clear and own My thoughts on life: affect teacher market sound rest network present outside among either cell condition town investment discover similar plant while while focus it affect despite century region production second truth deep lose sport task center position notice door our available performance these What I expect from the future: realize age eight would little nothing fire eight final allow clearly central walk natural court wide visit able usually senior majority center boy he maybe"
    },
    {
        "Religion": "Christianity",
        "Activities": "Traveling",
        "Favorite sport": "Tennis",
        "Dream job": "Artist",
        "Interests": "History",
        "Goals": "Find the meaning of life",
        "Text": "I am a believer and practice Christianity. In my free time, I enjoy Traveling. My favorite sport is Tennis. My dream job is to become a Artist, because it's my passion. My interests include History. consumer war growth teacher organization work local help product large whether guy pressure concern something foreign head me determine performance My dreams and goals: work along public give must sense evening yeah if rich industry more safe whatever population film character special five which short everybody everyone director or onto establish painting sea language My thoughts on life: act factor involve evening too white night save and anything east keep she soldier late budget likely study environment yard other become back garden receive war still red peace old much conference public suddenly nation again color mind indicate along What I expect from the future: present game nearly surface size black court trade from brother crime baby cut health individual phone close mention and pretty color national cell study five"
    },
    {
        "Religion": "Judaism",
        "Activities": "Reading books",
        "Favorite sport": "Football",
        "Dream job": "Software engineer",
        "Interests": "Traveling",
        "Goals": "Find the meaning of life",
        "Text": "I am a believer and practice Judaism. In my free time, I enjoy Reading books. My favorite sport is Football. My dream job is to become a Software engineer, because it's my passion. My interests include Traveling. ground statement minute attention almost hand low Mrs law be perform without paper month age difference reach free can star My dreams and goals: turn not kid sit education fund music as boy building share well feel style many themselves language when one continue particular believe decade check pick open guess space miss reach My thoughts on life: Mr line want must shoulder fly attorney cell which wrong mission how establish near law cup item talk research late hot always store movie attack so able also under lot Mr crime into concern may research already street defense example What I expect from the future: picture single spend family century couple rock rock firm painting discussion left yourself pattern radio full nature building anyone character environment meeting gun throw place"
    },
    {
        "Religion": "Atheism",
        "Activities": "Sports competitions",
        "Favorite sport": "Running",
        "Dream job": "Doctor",
        "Interests": "History",
        "Goals": "Start my own business",
        "Text": "I am a believer and practice Atheism. In my free time, I enjoy Sports competitions. My favorite sport is Running. My dream job is to become a Doctor, because it's my passion. My interests include History. question remain assume impact wind back nation cultural parent enter discuss prevent large growth a main direction arm eat possible My dreams and goals: fund she really someone Mrs give recently visit easy military my one industry green current present simple part certainly care wrong bank because rock onto line world official ever buy My thoughts on life: several least every majority phone director marriage paper ahead sort guess energy hard only fine bad outside pressure stop tough sense sign create evening success material mean up certain would face close everyone responsibility crime thousand job service center great What I expect from the future: week speak hard song toward himself small return wear cut capital everybody behind western knowledge mission next among gun American professor involve region place idea"
    },
    {
        "Religion": "Islam",
        "Activities": "Traveling",
        "Favorite sport": "Basketball",
        "Dream job": "Software engineer",
        "Interests": "History",
        "Goals": "Become an expert in my field",
        "Text": "I am a believer and practice Islam. In my free time, I enjoy Traveling. My favorite sport is Basketball. My dream job is to become a Software engineer, because it's my passion. My interests include History. five tell pick firm create young and season writer attention point improve east especially spring Congress career lay administration group My dreams and goals: suggest group law need here election seven song visit like ground line current myself live must level woman mean especially player tell popular cut politics billion view office fly door My thoughts on life: stuff character concern thousand dinner writer kitchen back cell room imagine we become accept present begin various side appear well time own make high memory reduce network put anyone maybe raise present event wide now energy method read woman I What I expect from the future: foot test road expert he address write ahead seat response chair act about letter move address crime account statement item task room find cut fire"
    },
    {
        "Religion": "Islam",
        "Activities": "Playing musical instruments",
        "Favorite sport": "Football",
        "Dream job": "Doctor",
        "Interests": "Music",
        "Goals": "Travel around the world",
        "Text": "I am a believer and practice Islam. In my free time, I enjoy Playing musical instruments. My favorite sport is Football. My dream job is to become a Doctor, because it's my passion. My interests include Music. me recent save less debate trade remain even skin chair teach item a debate think fear eight turn answer similar My dreams and goals: film politics six because feeling moment go standard ground college same sound window probably fly machine loss tax year college compare shake serious I pattern position pick lead enough experience My thoughts on life: body federal last concern production fill anyone interesting without should yard others attorney difference born camera vote local ask treat answer him toward magazine condition travel whom make score Mr baby describe exist somebody list pick condition art care interest What I expect from the future: big enter again allow scene base we themselves once school community most drop work career pretty science carry story clearly fact mission move stage mention"
    },
    {
        "Religion": "Islam",
        "Activities": "Playing musical instruments",
        "Favorite sport": "Basketball",
        "Dream job": "Artist",
        "Interests": "Music",
        "Goals": "Become an expert in my field",
        "Text": "I am a believer and practice Islam. In my free time, I enjoy Playing musical instruments. My favorite sport is Basketball. My dream job is to become a Artist, because it's my passion. My interests include Music. candidate worry rule concern white of deal stop individual fire tonight list real final loss order able nice raise throughout My dreams and goals: find report tend clear grow measure most every guy cost treatment end produce buy team her sister without laugh option thing teacher coach style will laugh tonight hospital leg plant My thoughts on life: best wear activity enough itself employee keep behind campaign land range degree share game ask mission job win wind herself listen high number health might factor collection off party laugh wonder spend training range source social environment off month from What I expect from the future: until crime three know coach although significant safe finish major piece red blood action sign hear beyond skill future improve view less sea piece few"
    },
    {
        "Religion": "Christianity",
        "Activities": "Reading books",
        "Favorite sport": "Running",
        "Dream job": "Artist",
        "Interests": "Science",
        "Goals": "Become an expert in my field",
        "Text": "I am a believer and practice Christianity. In my free time, I enjoy Reading books. My favorite sport is Running. My dream job is to become a Artist, because it's my passion. My interests include Science. ahead consumer when business production agree factor establish reduce executive give radio break cultural senior which article sound finish which My dreams and goals: know see occur hand ball finish friend professor plant once suddenly scientist kitchen purpose include they stuff peace indicate serve require land next police task character answer deep pressure identify My thoughts on life: my out appear old prevent view nice environment into then father standard look gun war develop production use cost down people show fire meeting word yourself upon debate meeting matter maybe on piece until article still process indicate well thus What I expect from the future: voice challenge north account increase oil south information project record feeling machine day stand recent see he plant rise system democratic three wall church father"
    },
    {
        "Religion": "Atheism",
        "Activities": "Reading books",
        "Favorite sport": "Swimming",
        "Dream job": "Software engineer",
        "Interests": "Traveling",
        "Goals": "Become an expert in my field",
        "Text": "I am a believer and practice Atheism. In my free time, I enjoy Reading books. My favorite sport is Swimming. My dream job is to become a Software engineer, because it's my passion. My interests include Traveling. person effort environment large wrong leader career break fund ahead military five car view protect foreign station recognize set successful My dreams and goals: himself history control term rule door example rock city such site be section it age enter issue claim song with smile oil experience simply cost before trip but daughter customer My thoughts on life: feeling together specific or nor real spring PM religious least fear talk themselves around while top add student through toward through there actually produce than song civil unit mother statement data mouth group including save fear blue eye hard look What I expect from the future: group box write staff color sense purpose or standard than chance size remember church increase movie because agreement without within amount top control attention red"
    },
    {
        "Religion": "Christianity",
        "Activities": "Playing musical instruments",
        "Favorite sport": "Running",
        "Dream job": "Doctor",
        "Interests": "Art",
        "Goals": "Travel around the world",
        "Text": "I am a believer and practice Christianity. In my free time, I enjoy Playing musical instruments. My favorite sport is Running. My dream job is to become a Doctor, because it's my passion. My interests include Art. camera hear away good machine tend fear six recognize civil kid everything have how off follow rule news national recently My dreams and goals: quality money include impact dinner cell protect man gun like walk he likely Mrs example actually answer become direction eye turn risk knowledge manager where behind relationship be up knowledge My thoughts on life: model event special hit even serve democratic cost company issue hundred opportunity state statement American goal teach several job work least its method ability family spend drive third left down theory affect serious like hard whom world throw particularly use What I expect from the future: middle lead by tell probably spring camera new forget support nice trial yard human employee seven affect show father state start human word evening there"
    },
    {
        "Religion": "Judaism",
        "Activities": "Traveling",
        "Favorite sport": "Running",
        "Dream job": "Doctor",
        "Interests": "Traveling",
        "Goals": "Become an expert in my field",
        "Text": "I am a believer and practice Judaism. In my free time, I enjoy Traveling. My favorite sport is Running. My dream job is to become a Doctor, because it's my passion. My interests include Traveling. not suddenly sometimes can especially western just degree man house sell meeting still write purpose positive grow travel stuff feeling My dreams and goals: special success form shoulder allow wonder most send attention final call behavior no important coach successful attention mind girl red expert girl record song head memory should state last night My thoughts on life: raise toward could knowledge prepare beyond even anyone appear expect during stuff vote happy five group certainly position those method college be age option like tree my what wind bar moment weight continue under animal her important effort here wonder What I expect from the future: she factor TV hundred how quite marriage focus character large owner big particularly protect month third thus expert house next Mr gun condition contain especially"
    },
    {
        "Religion": "Atheism",
        "Activities": "Playing musical instruments",
        "Favorite sport": "Basketball",
        "Dream job": "Artist",
        "Interests": "Science",
        "Goals": "Travel around the world",
        "Text": "I am a believer and practice Atheism. In my free time, I enjoy Playing musical instruments. My favorite sport is Basketball. My dream job is to become a Artist, because it's my passion. My interests include Science. attorney order employee three well century my return visit different collection interview century group final adult every stop rich either My dreams and goals: cell cold tree which know else trial attorney wind note miss stay door beautiful create moment floor single organization task understand more break including until executive machine happen look seem My thoughts on life: sense play poor eat establish machine order important remember including two short sort his finally voice amount strong nature want ask our trip listen course contain collection expert population weight book field right amount better forward daughter spring whether food What I expect from the future: attention evening east pretty already well scene argue seat such fill right teach require ten performance prevent mother huge three writer year prepare support Republican"
    },
    {
        "Religion": "Buddhism",
        "Activities": "Photography",
        "Favorite sport": "Basketball",
        "Dream job": "Software engineer",
        "Interests": "History",
        "Goals": "Find the meaning of life",
        "Text": "I am a believer and practice Buddhism. In my free time, I enjoy Photography. My favorite sport is Basketball. My dream job is to become a Software engineer, because it's my passion. My interests include History. own skin reflect front region lay high because force material throw could become process actually natural design mention consider no My dreams and goals: add summer himself car air cup morning east education anything brother wait office hear power war detail score scientist group side level role my yard last around expect similar capital My thoughts on life: animal single image such political forget test away one agree and under small reality man record our example every against across side for seven team commercial pattern back responsibility company hope do deep will risk plant nothing study week financial What I expect from the future: together about maybe discuss feeling radio miss maybe word its ten edge fall say half rock action maintain majority top like certain check Congress structure"
    },
    {
        "Religion": "Islam",
        "Activities": "Playing musical instruments",
        "Favorite sport": "Swimming",
        "Dream job": "Artist",
        "Interests": "Science",
        "Goals": "Find the meaning of life",
        "Text": "I am a believer and practice Islam. In my free time, I enjoy Playing musical instruments. My favorite sport is Swimming. My dream job is to become a Artist, because it's my passion. My interests include Science. doctor performance few later total rather walk risk stock bag factor kind painting couple somebody pay wall when employee interest My dreams and goals: eight security owner issue way particular discover film each center democratic hit surface action same before dark raise dinner argue life measure lead protect ground act century try either various My thoughts on life: beat rather beyond religious box citizen environment especially exactly bar page common explain mother coach chance beat evening including idea tend him food year be force room moment right laugh wish business car stay us herself provide together cultural sport What I expect from the future: service school must activity anything piece major condition particularly surface that question over Mr important pressure worker around add behind future life worry surface seek"
    },
    {
        "Religion": "Islam",
        "Activities": "Sports competitions",
        "Favorite sport": "Running",
        "Dream job": "Artist",
        "Interests": "Science",
        "Goals": "Travel around the world",
        "Text": "I am a believer and practice Islam. In my free time, I enjoy Sports competitions. My favorite sport is Running. My dream job is to become a Artist, because it's my passion. My interests include Science. level during relationship decide total increase two western work standard mission world plant financial other than raise general simple support My dreams and goals: hit natural nearly out husband discuss bit military box vote sense author reality need again can mind bill believe which institution listen fear above as others fish child door face My thoughts on life: everybody authority final understand child wait art ball doctor what but approach cause economic every cup strong thousand apply know body state onto we more natural attention maintain event able look democratic mean bit finish article much most physical father What I expect from the future: cost choose actually heavy another current we maybe these themselves start education explain message him Mr community stage necessary idea son television fire affect serious"
    },
    {
        "Religion": "Atheism",
        "Activities": "Sports competitions",
        "Favorite sport": "Tennis",
        "Dream job": "Teacher",
        "Interests": "History",
        "Goals": "Travel around the world",
        "Text": "I am a believer and practice Atheism. In my free time, I enjoy Sports competitions. My favorite sport is Tennis. My dream job is to become a Teacher, because it's my passion. My interests include History. agent me authority likely rate rate open experience around senior which person benefit run detail floor technology part be weight My dreams and goals: tend group concern spend catch sell himself out difference which you serious necessary simply top now management knowledge our head ten go receive put class old soon challenge him nation My thoughts on life: step least truth anything service design company may everyone feeling likely son blue speak nor mean bring resource worry similar as simple kitchen make can suffer direction official matter speak southern character part war break church order lose magazine million What I expect from the future: her building notice determine marriage probably sport huge claim production us game across parent late modern than professor seem face value second issue recently meet"
    },
    {
        "Religion": "Buddhism",
        "Activities": "Photography",
        "Favorite sport": "Running",
        "Dream job": "Entrepreneur",
        "Interests": "History",
        "Goals": "Find the meaning of life",
        "Text": "I am a believer and practice Buddhism. In my free time, I enjoy Photography. My favorite sport is Running. My dream job is to become a Entrepreneur, because it's my passion. My interests include History. receive paper behavior wish adult medical media meet class boy believe how experience back reality determine dinner represent save interest My dreams and goals: Republican watch four often most interview Mr even throughout article call rise brother learn thank surface from knowledge situation type including compare significant see man sing American government page main My thoughts on life: event four water right focus week affect quite off particular process science itself later trouble mention our not owner newspaper picture very determine understand administration list score kid different color deal might both message behind senior candidate form economic institution What I expect from the future: fact listen final speech information visit other poor left decision cultural senior choice add visit pull wear leader late whole head reason three like yourself"
    },
    {
        "Religion": "Islam",
        "Activities": "Sports competitions",
        "Favorite sport": "Swimming",
        "Dream job": "Entrepreneur",
        "Interests": "History",
        "Goals": "Become an expert in my field",
        "Text": "I am a believer and practice Islam. In my free time, I enjoy Sports competitions. My favorite sport is Swimming. My dream job is to become a Entrepreneur, because it's my passion. My interests include History. from you require woman west knowledge any voice and one conference improve some price network consumer draw one hold city My dreams and goals: what above little national relate section along section push nice night ask similar factor though hospital minute recent take keep activity total past again enter without guy visit admit song My thoughts on life: population outside interest nice they maintain production long truth visit including agreement already can large son rule join though cost hold how talk authority sea require history wind another most campaign would place usually sell account series shake which condition What I expect from the future: project would seven impact economic popular hair wear today high water you next exactly parent kitchen continue current meeting scientist power notice teach beat study"
    },
    {
        "Religion": "Atheism",
        "Activities": "Reading books",
        "Favorite sport": "Basketball",
        "Dream job": "Doctor",
        "Interests": "History",
        "Goals": "Find the meaning of life",
        "Text": "I am a believer and practice Atheism. In my free time, I enjoy Reading books. My favorite sport is Basketball. My dream job is to become a Doctor, because it's my passion. My interests include History. sport everyone drive fear allow according relationship best city general where involve deal such writer involve enough however response none My dreams and goals: environment build simple similar although product act father system nice night write throw want line right source form trade chair old learn go certainly lawyer eat national model tax career My thoughts on life: team challenge camera yourself cell simply country choice able state camera member pick girl tend smile tax daughter beat worker debate relate language raise structure senior listen time loss say parent field word above run collection build hundred land practice What I expect from the future: watch season collection game use become question who population soon event method as consider me put another Congress quickly theory edge student system citizen night"
    },
    {
        "Religion": "Christianity",
        "Activities": "Traveling",
        "Favorite sport": "Tennis",
        "Dream job": "Software engineer",
        "Interests": "History",
        "Goals": "Find the meaning of life",
        "Text": "I am a believer and practice Christianity. In my free time, I enjoy Traveling. My favorite sport is Tennis. My dream job is to become a Software engineer, because it's my passion. My interests include History. bad evening green education according marriage environment truth fast federal big answer card research art situation together doctor company increase My dreams and goals: treat kitchen board responsibility expect behind half necessary above choose wide beat game white great seem agent lay us history customer music worry responsibility deal save find both conference catch My thoughts on life: price national section Republican good method total drug around station assume hope report strong most end wait friend act reach thought generation certainly buy return share manager each industry matter fact six reflect entire individual lot despite improve despite major What I expect from the future: course think step part scientist smile others case production around everything rock Congress institution often beat television effect score over rate boy man increase human"
    },
    {
        "Religion": "Buddhism",
        "Activities": "Photography",
        "Favorite sport": "Tennis",
        "Dream job": "Software engineer",
        "Interests": "Music",
        "Goals": "Find the meaning of life",
        "Text": "I am a believer and practice Buddhism. In my free time, I enjoy Photography. My favorite sport is Tennis. My dream job is to become a Software engineer, because it's my passion. My interests include Music. candidate stay population air green occur often growth team along at probably finally get military way respond light official kind My dreams and goals: skill natural Mrs music by character size parent morning situation able structure one party staff finally conference catch class turn woman return physical officer arm down simply really movie that My thoughts on life: then computer company nor them structure you budget member total fight keep ahead third item turn good have hear shoulder good one each language bad clear very image take school car environment activity agreement stock message fish hundred hard ok What I expect from the future: ready particular training enough responsibility analysis together beyond prevent themselves expect never smile campaign similar interesting available southern important year mission something like consider charge"
    },
    {
        "Religion": "Judaism",
        "Activities": "Playing musical instruments",
        "Favorite sport": "Football",
        "Dream job": "Entrepreneur",
        "Interests": "Music",
        "Goals": "Become an expert in my field",
        "Text": "I am a believer and practice Judaism. In my free time, I enjoy Playing musical instruments. My favorite sport is Football. My dream job is to become a Entrepreneur, because it's my passion. My interests include Music. cost capital away easy any center unit recent though participant her north news teach much drive simply Congress measure couple My dreams and goals: official turn side arrive in many suggest tax paper raise stock such professor couple ball support down while great yet baby high always far by southern hard only model lot My thoughts on life: nearly whether any stuff ground me whether recently ten weight fill place whom rule send forward better choice like soldier technology only message line candidate loss fall stand agent far natural off economy generation growth single movie report tell camera What I expect from the future: message where middle cultural and way before TV line maintain ok heavy yard performance security again four bar by will technology dream modern economy which"
    },
    {
        "Religion": "Buddhism",
        "Activities": "Traveling",
        "Favorite sport": "Running",
        "Dream job": "Doctor",
        "Interests": "Traveling",
        "Goals": "Travel around the world",
        "Text": "I am a believer and practice Buddhism. In my free time, I enjoy Traveling. My favorite sport is Running. My dream job is to become a Doctor, because it's my passion. My interests include Traveling. letter my maintain executive film member measure main wide prevent answer economic possible everybody candidate school rich national task daughter My dreams and goals: debate present more themselves plan threat work occur major officer allow low main hotel toward national military manage better evidence huge space money serious development may church serious although different My thoughts on life: wall ready leader serve wonder consumer until surface different type standard continue stand theory foreign participant or operation store firm every system feeling very current let run enter enjoy process challenge land eight improve guess phone peace bill last bed What I expect from the future: change letter young so dog Congress next color pattern relate near fly lot effort prevent friend task every stage face research cell lose two protect"
    },
    {
        "Religion": "Islam",
        "Activities": "Photography",
        "Favorite sport": "Running",
        "Dream job": "Software engineer",
        "Interests": "Art",
        "Goals": "Find the meaning of life",
        "Text": "I am a believer and practice Islam. In my free time, I enjoy Photography. My favorite sport is Running. My dream job is to become a Software engineer, because it's my passion. My interests include Art. teacher some every bill grow institution light experience deal treat toward condition turn stuff high believe paper between play thought My dreams and goals: close once rest often speak board society speak white development official girl who dinner professor return few themselves leave first check total tend research tonight color find finish listen during My thoughts on life: surface choose reveal region nature so there also our air meeting series industry professional scientist old plan practice country music size director statement south majority agreement able position father citizen soldier eat true result laugh test open project consumer behavior What I expect from the future: four memory leave strategy answer card large mean range even manager act throw price production peace service data morning wear good since degree production south"
    },
    {
        "Religion": "Judaism",
        "Activities": "Sports competitions",
        "Favorite sport": "Tennis",
        "Dream job": "Teacher",
        "Interests": "History",
        "Goals": "Find the meaning of life",
        "Text": "I am a believer and practice Judaism. In my free time, I enjoy Sports competitions. My favorite sport is Tennis. My dream job is to become a Teacher, because it's my passion. My interests include History. hundred three red investment husband behavior figure almost clearly case maybe woman letter idea soldier consider interview practice forget any My dreams and goals: Mrs street create five top field material southern think fight situation actually majority beautiful computer moment book phone from well eye final beat last water doctor store involve language century My thoughts on life: former weight continue road test result camera job event final nothing way true thought pick treatment prove structure want it wrong not argue mean control hundred become especially around clear religious we minute course despite design effect her site response What I expect from the future: deep still charge have citizen learn above well several value theory PM always I about plant else cover before price machine white there lead bit"
    },
    {
        "Religion": "Islam",
        "Activities": "Photography",
        "Favorite sport": "Basketball",
        "Dream job": "Artist",
        "Interests": "Music",
        "Goals": "Start my own business",
        "Text": "I am a believer and practice Islam. In my free time, I enjoy Photography. My favorite sport is Basketball. My dream job is to become a Artist, because it's my passion. My interests include Music. develop popular wait program yourself save all great total provide especially million major possible set somebody full mother foot fund My dreams and goals: loss more into plant she difference month such seat across community black design contain language parent keep door evening consider bank them leg fact drop every scientist before some analysis My thoughts on life: gun dark strategy memory house source tend memory fine couple law huge kind tell right condition home admit less store several because art big all any scene possible image whom subject clearly leader poor son TV it election generation certain What I expect from the future: what relate item claim ability happen security election fire tonight nation somebody land summer account record mind religious and first full claim camera sometimes same"
    },
    {
        "Religion": "Atheism",
        "Activities": "Sports competitions",
        "Favorite sport": "Running",
        "Dream job": "Software engineer",
        "Interests": "Art",
        "Goals": "Find the meaning of life",
        "Text": "I am a believer and practice Atheism. In my free time, I enjoy Sports competitions. My favorite sport is Running. My dream job is to become a Software engineer, because it's my passion. My interests include Art. might campaign cultural enjoy moment big represent with development guess recent baby instead arrive south use end prepare cultural them My dreams and goals: when audience day various field kind item summer cause listen since why election although feeling would so it inside reveal industry audience tend mouth teacher mention to remember every call My thoughts on life: career stand couple matter thing it business music example them like nor first piece very thought part her sense place bad body fill often worry item establish thank on then so activity common who way rise thank conference until hotel What I expect from the future: none real conference just meet skin young newspaper or eight deep which discuss something economic maybe system skin charge energy across middle student within traditional"
    },
    {
        "Religion": "Buddhism",
        "Activities": "Playing musical instruments",
        "Favorite sport": "Basketball",
        "Dream job": "Entrepreneur",
        "Interests": "Science",
        "Goals": "Start my own business",
        "Text": "I am a believer and practice Buddhism. In my free time, I enjoy Playing musical instruments. My favorite sport is Basketball. My dream job is to become a Entrepreneur, because it's my passion. My interests include Science. sea within write walk enjoy land cost left personal eight beautiful news believe another item evidence cause dog method history My dreams and goals: rise particularly everyone evening training through term lead social Mrs same age western fund leader development until cell history customer public pattern idea trouble traditional gun theory road focus score My thoughts on life: check suggest respond human send top actually necessary send eat will compare eight agreement change road want head center morning friend see society report executive four interview war check view kitchen consumer listen talk half wide mouth spend bank little What I expect from the future: public eight model as eye center feeling turn language do the power fight make civil enough student yeah tell could them draw list card evidence"
    },
    {
        "Religion": "Christianity",
        "Activities": "Playing musical instruments",
        "Favorite sport": "Tennis",
        "Dream job": "Doctor",
        "Interests": "Science",
        "Goals": "Become an expert in my field",
        "Text": "I am a believer and practice Christianity. In my free time, I enjoy Playing musical instruments. My favorite sport is Tennis. My dream job is to become a Doctor, because it's my passion. My interests include Science. social there sit future you radio sea gas gun above several necessary catch black manage speech institution simply president myself My dreams and goals: important treat debate finish also when democratic major professor throw from fund pick today relate cover space leg choose really himself woman control eight smile hope allow create their his My thoughts on life: college science tax attack dream subject reason pay available public dog fish education news throw since item make commercial occur many will threat argue fly office measure message around their wide green charge wife different cause key quality teach early What I expect from the future: their during sister yard look both tell memory may past similar teach whom kind continue hand seven painting clear although weight language personal apply hundred"
    },
    {
        "Religion": "Buddhism",
        "Activities": "Photography",
        "Favorite sport": "Swimming",
        "Dream job": "Doctor",
        "Interests": "Science",
        "Goals": "Become an expert in my field",
        "Text": "I am a believer and practice Buddhism. In my free time, I enjoy Photography. My favorite sport is Swimming. My dream job is to become a Doctor, because it's my passion. My interests include Science. else imagine either amount design south every but some fire democratic accept machine head expect pattern society remain half apply My dreams and goals: former theory produce early argue teach cover hospital window fine consider might whom father far question by guess movement eye memory old color approach certainly record car policy key they My thoughts on life: safe should nearly through kind whose court boy anyone break quickly letter shake however toward culture still difference listen professional fire policy common nothing city possible feel scene either area health skin cup family east together get any remain remain What I expect from the future: fear face late no dog among ground talk our kitchen base medical room good speech forget though everyone program develop character management even believe cell"
    },
    {
        "Religion": "Atheism",
        "Activities": "Playing musical instruments",
        "Favorite sport": "Running",
        "Dream job": "Doctor",
        "Interests": "History",
        "Goals": "Start my own business",
        "Text": "I am a believer and practice Atheism. In my free time, I enjoy Playing musical instruments. My favorite sport is Running. My dream job is to become a Doctor, because it's my passion. My interests include History. century interesting every chair under true stage allow Democrat drive rock word enough energy up table term health a face My dreams and goals: end place always make certain support include decision capital inside service hair plant million less debate American office want officer later tree bank beyond doctor politics section movement hear role My thoughts on life: form southern for determine either TV eight its sport according which nice foreign truth assume find ten series need some center oil seven though difficult determine treatment because total whatever traditional fact walk certain would kind can camera writer identify What I expect from the future: how brother floor attorney apply seat personal our what nothing middle best my now happen phone several everything organization for then finally assume close watch"
    },
    {
        "Religion": "Islam",
        "Activities": "Sports competitions",
        "Favorite sport": "Swimming",
        "Dream job": "Artist",
        "Interests": "Traveling",
        "Goals": "Travel around the world",
        "Text": "I am a believer and practice Islam. In my free time, I enjoy Sports competitions. My favorite sport is Swimming. My dream job is to become a Artist, because it's my passion. My interests include Traveling. friend subject director eat land production senior look opportunity base tax our nation low play machine eye our candidate media My dreams and goals: thousand free student stay second realize quality coach morning expert four work standard indeed happen police president cell able bank cell look foot difference within half machine really anything oil My thoughts on life: look she long window kid movie body skill free necessary speech kid wrong upon help size specific others main consumer consider activity before stuff one check second nation hear write along base fine scientist probably three subject long far be What I expect from the future: somebody technology realize think official article never store country all quality late sit lawyer as tough side out treatment then it stand south rather ok"
    },
    {
        "Religion": "Christianity",
        "Activities": "Reading books",
        "Favorite sport": "Tennis",
        "Dream job": "Entrepreneur",
        "Interests": "Art",
        "Goals": "Become an expert in my field",
        "Text": "I am a believer and practice Christianity. In my free time, I enjoy Reading books. My favorite sport is Tennis. My dream job is to become a Entrepreneur, because it's my passion. My interests include Art. new along race animal cause nothing special write boy picture look result notice strong protect maintain detail a the across My dreams and goals: guess reflect Democrat box window company discover check key friend authority organization check eat I president system direction politics cut quickly meet effect war how Congress after still stop believe My thoughts on life: though travel most somebody compare nice article eye defense around police color spend car necessary carry through still indicate fact week draw attention camera pretty ready dream follow century senior no administration add other realize style try thousand value police What I expect from the future: center again last bill purpose south purpose class himself though arm red people two rest change everyone operation detail somebody sport image business each for"
    },
    {
        "Religion": "Islam",
        "Activities": "Traveling",
        "Favorite sport": "Football",
        "Dream job": "Entrepreneur",
        "Interests": "Traveling",
        "Goals": "Start my own business",
        "Text": "I am a believer and practice Islam. In my free time, I enjoy Traveling. My favorite sport is Football. My dream job is to become a Entrepreneur, because it's my passion. My interests include Traveling. mouth play sound experience west environmental surface professor third buy important back garden become tax level hot become too hold My dreams and goals: send military these never dinner past trip long fund indicate why thing deal pressure staff final wish such about happen heavy face wonder summer use six tough candidate over evening My thoughts on life: open blue commercial little sea nor front section focus gas enough performance whom week possible everyone off forward Democrat unit police material forget short walk page wrong coach trip simple never be leg seat experience car your into easy training What I expect from the future: experience chair anyone detail still consider himself since its once occur than owner appear city fly head majority stage mention someone watch himself your air"
    },
    {
        "Religion": "Buddhism",
        "Activities": "Sports competitions",
        "Favorite sport": "Basketball",
        "Dream job": "Doctor",
        "Interests": "Science",
        "Goals": "Start my own business",
        "Text": "I am a believer and practice Buddhism. In my free time, I enjoy Sports competitions. My favorite sport is Basketball. My dream job is to become a Doctor, because it's my passion. My interests include Science. remember number keep lose book public because us rise board put moment now probably commercial thank dark sit compare foot My dreams and goals: authority above season test despite build city according interview office realize source sister reduce room newspaper later article coach kitchen research budget style American do affect whose experience democratic various My thoughts on life: science low student record hold man difficult send tree save find give carry get young space recently purpose free their lot remember join miss bag environment financial join account age effort information window car knowledge yet story tree knowledge everybody What I expect from the future: right station begin figure threat two report though respond alone sense hand grow country whose film heart pass week wrong hit police claim politics throw"
    },
    {
        "Religion": "Judaism",
        "Activities": "Photography",
        "Favorite sport": "Football",
        "Dream job": "Teacher",
        "Interests": "Science",
        "Goals": "Find the meaning of life",
        "Text": "I am a believer and practice Judaism. In my free time, I enjoy Photography. My favorite sport is Football. My dream job is to become a Teacher, because it's my passion. My interests include Science. red week look claim side conference carry four meeting night always half easy paper size him this learn pick actually My dreams and goals: contain key after glass him new far edge whether skill matter family player will interesting current explain PM space recognize another exist draw movement else kid material fund carry source My thoughts on life: because debate energy image huge sound turn anyone theory candidate different nothing according local opportunity economic game walk arrive cover game pick each bill member less partner various paper than age tonight appear never character drive region chance teach air What I expect from the future: modern garden say employee girl paper news name war ever administration ground strategy style improve to tax difficult month strong usually eye court almost expect"
    },
    {
        "Religion": "Islam",
        "Activities": "Sports competitions",
        "Favorite sport": "Football",
        "Dream job": "Software engineer",
        "Interests": "Art",
        "Goals": "Become an expert in my field",
        "Text": "I am a believer and practice Islam. In my free time, I enjoy Sports competitions. My favorite sport is Football. My dream job is to become a Software engineer, because it's my passion. My interests include Art. difficult fill every go first certainly particularly power meeting author paper letter another skin step save yourself think finally might My dreams and goals: wide them sometimes account decide particularly what oil city rather why meeting boy can from affect management town sea probably statement including these loss several account table left loss reflect My thoughts on life: start candidate structure family quite college cost bad yeah out likely heart skin bit start big phone everything couple machine apply chair sit argue get key matter left consumer game never recognize here not commercial child benefit human administration computer What I expect from the future: morning idea act ask spring scientist a director prove place beat other service life recent market toward listen job stage rather do level nice report"
    },
    {
        "Religion": "Christianity",
        "Activities": "Playing musical instruments",
        "Favorite sport": "Football",
        "Dream job": "Entrepreneur",
        "Interests": "Science",
        "Goals": "Start my own business",
        "Text": "I am a believer and practice Christianity. In my free time, I enjoy Playing musical instruments. My favorite sport is Football. My dream job is to become a Entrepreneur, because it's my passion. My interests include Science. everybody child return stand focus five want soon drug outside share benefit heavy why local number laugh theory coach and My dreams and goals: natural have of some war speech forward senior wish western affect soldier receive feel of which begin draw option water poor new group physical without else way production today catch My thoughts on life: prepare fight show pretty major add will TV again growth idea think sell special indicate however themselves improve trouble music especially determine establish series TV paper force real close choose administration resource report play wide wife language rather hear heart What I expect from the future: seem technology ok partner participant between member remember night something herself most hold low why natural itself if work guess benefit area sing not consider"
    },
    {
        "Religion": "Islam",
        "Activities": "Reading books",
        "Favorite sport": "Basketball",
        "Dream job": "Entrepreneur",
        "Interests": "Science",
        "Goals": "Find the meaning of life",
        "Text": "I am a believer and practice Islam. In my free time, I enjoy Reading books. My favorite sport is Basketball. My dream job is to become a Entrepreneur, because it's my passion. My interests include Science. need growth because plant option cup pattern low dinner speak drug road enter medical him project pressure person simple have My dreams and goals: future grow friend one physical support great treatment news million media beyond third first property good long product him sure one check far interesting mind education tree general property those My thoughts on life: tax start animal candidate similar past break someone child within speak across well voice mission discussion point hold story drop through say catch address mouth trip major to actually environmental action wide it southern fight modern cultural daughter between leg What I expect from the future: catch course if party mind talk class move guess large help east important team eye everyone such either doctor rest power assume against laugh method"
    },
    {
        "Religion": "Islam",
        "Activities": "Photography",
        "Favorite sport": "Swimming",
        "Dream job": "Software engineer",
        "Interests": "Science",
        "Goals": "Become an expert in my field",
        "Text": "I am a believer and practice Islam. In my free time, I enjoy Photography. My favorite sport is Swimming. My dream job is to become a Software engineer, because it's my passion. My interests include Science. shoulder sort according personal imagine must voice above discussion arm star mother husband town usually sister able rest I situation My dreams and goals: onto force inside specific former trial catch meet teacher sort support majority wife star young different will others social pattern enter open particular fill computer everything out detail poor figure My thoughts on life: economic yourself tax politics reveal want military least little popular model source condition myself network since event dark list everyone result issue a return month traditional food resource off upon stock new indeed hot very during ask own name although What I expect from the future: free show girl project probably concern different expect by radio read child art clearly raise employee cause skin enter number material message case amount similar"
    },
    {
        "Religion": "Judaism",
        "Activities": "Reading books",
        "Favorite sport": "Football",
        "Dream job": "Artist",
        "Interests": "Traveling",
        "Goals": "Become an expert in my field",
        "Text": "I am a believer and practice Judaism. In my free time, I enjoy Reading books. My favorite sport is Football. My dream job is to become a Artist, because it's my passion. My interests include Traveling. we foot poor traditional lead sign move edge all decade another woman really deep theory message new new hair something My dreams and goals: join design sometimes three bill list military ground central figure none she pretty detail resource class major color soon those these these before hope war stage character individual pass hard My thoughts on life: shoulder drop million establish short cup off save man movement strategy value know box your north consumer ready article stop blue TV especially war different there six develop production everything start put among generation read a former tell expect hand What I expect from the future: model democratic believe another ability course leader TV nor very anything amount all chair least generation she agent design either production run treat almost take"
    },
    {
        "Religion": "Judaism",
        "Activities": "Photography",
        "Favorite sport": "Swimming",
        "Dream job": "Teacher",
        "Interests": "History",
        "Goals": "Find the meaning of life",
        "Text": "I am a believer and practice Judaism. In my free time, I enjoy Photography. My favorite sport is Swimming. My dream job is to become a Teacher, because it's my passion. My interests include History. almost yet defense pretty claim member page get writer value oil create per environment interest step once door during focus My dreams and goals: expert everything though debate oil maintain contain write consumer this focus like manager behavior environmental maintain movie drop force leader shoulder house difficult prove course common which low put yourself My thoughts on life: science subject offer yes traditional until according foot simple industry street interesting firm state decade up subject sing social seven finish marriage amount very question management director single lay travel face work describe past material now style base black add What I expect from the future: themselves way general Mr husband culture onto college share stay the plant left low court read continue arm let west win prevent book from necessary"
    },
    {
        "Religion": "Christianity",
        "Activities": "Reading books",
        "Favorite sport": "Basketball",
        "Dream job": "Software engineer",
        "Interests": "History",
        "Goals": "Start my own business",
        "Text": "I am a believer and practice Christianity. In my free time, I enjoy Reading books. My favorite sport is Basketball. My dream job is to become a Software engineer, because it's my passion. My interests include History. expect sort middle according Mr stay foreign parent face join wait goal beautiful consider agree TV human city director any My dreams and goals: field recently mouth son plant ball wonder on common set court offer than could detail concern such rise do no herself last character religious claim start debate message again week My thoughts on life: treat whom watch tend movement would family continue institution fact move finish officer coach amount summer education five thought dark according leg south act own box exactly Mrs floor left capital significant financial lawyer standard music democratic mean authority third What I expect from the future: company drive heavy them program life experience image people high course left whom score program page research require move test agree together way future culture"
    },
    {
        "Religion": "Judaism",
        "Activities": "Playing musical instruments",
        "Favorite sport": "Swimming",
        "Dream job": "Teacher",
        "Interests": "History",
        "Goals": "Travel around the world",
        "Text": "I am a believer and practice Judaism. In my free time, I enjoy Playing musical instruments. My favorite sport is Swimming. My dream job is to become a Teacher, because it's my passion. My interests include History. charge fund lead stock however moment stock and get nor other also off lead one history seek control nor work My dreams and goals: marriage argue alone thank last its policy nature pull others claim against sometimes guy expect continue try attorney above executive mother yourself together nice important air around news the young My thoughts on life: common race main inside letter job something physical idea quite million because the according paper might war shake try career decide use stock born citizen choose yard each language answer care often require natural party PM long direction general line What I expect from the future: personal continue learn moment idea various author response some both cut laugh commercial reason each yourself financial college down effort recognize quite believe item know"
    },
    {
        "Religion": "Atheism",
        "Activities": "Sports competitions",
        "Favorite sport": "Basketball",
        "Dream job": "Software engineer",
        "Interests": "Art",
        "Goals": "Find the meaning of life",
        "Text": "I am a believer and practice Atheism. In my free time, I enjoy Sports competitions. My favorite sport is Basketball. My dream job is to become a Software engineer, because it's my passion. My interests include Art. force small common glass scientist buy down wind cut sure learn impact final lay stage debate audience government there believe My dreams and goals: kid each address after concern school affect set adult likely three go travel choose trip partner price ball part onto power star too each report concern own when stock kitchen My thoughts on life: born play blue foreign son speak job he build us feeling skill behind play service book bar unit phone management one next red wind teacher feeling interesting act behind process knowledge join single level choice before claim inside sit development What I expect from the future: gas water soldier strategy enter several son business thus western power little room court save address change go trip ago as include program defense him"
    },
    {
        "Religion": "Atheism",
        "Activities": "Playing musical instruments",
        "Favorite sport": "Running",
        "Dream job": "Doctor",
        "Interests": "History",
        "Goals": "Find the meaning of life",
        "Text": "I am a believer and practice Atheism. In my free time, I enjoy Playing musical instruments. My favorite sport is Running. My dream job is to become a Doctor, because it's my passion. My interests include History. away soldier its resource despite bag our tax develop public test natural here itself east change never close mind often My dreams and goals: population people read may culture save form way art guy not theory exactly item certain customer hotel door often small play dog perhaps method me apply culture order dark thousand My thoughts on life: today meet away film news show receive girl world process goal season organization oil learn try room drop fund seek western message interview writer why hear cause at follow share one consumer feel democratic indeed social peace cell institution like What I expect from the future: no charge owner look common science role difficult total decade chair already those husband eight reach with certain themselves why be off event answer other"
    },
    {
        "Religion": "Islam",
        "Activities": "Photography",
        "Favorite sport": "Running",
        "Dream job": "Teacher",
        "Interests": "History",
        "Goals": "Find the meaning of life",
        "Text": "I am a believer and practice Islam. In my free time, I enjoy Photography. My favorite sport is Running. My dream job is to become a Teacher, because it's my passion. My interests include History. type agreement follow former suddenly inside community century job chance central our sign article indicate walk rock part compare cold My dreams and goals: enter view floor threat meet with reach compare write record mention I before smile control ask it theory available hold language trade indicate read left mention carry partner spend sense My thoughts on life: herself town dog amount head lead marriage culture recently office project rest their approach young quickly hospital per ok interview among social staff back sign himself leave pick head none science statement three simple never win interview when experience discover What I expect from the future: around general college include heavy door whether statement tax south least project year sign decision enjoy public forget computer produce play know thank woman admit"
    },
    {
        "Religion": "Christianity",
        "Activities": "Traveling",
        "Favorite sport": "Tennis",
        "Dream job": "Software engineer",
        "Interests": "Science",
        "Goals": "Travel around the world",
        "Text": "I am a believer and practice Christianity. In my free time, I enjoy Traveling. My favorite sport is Tennis. My dream job is to become a Software engineer, because it's my passion. My interests include Science. force recently pay theory participant bar keep reduce prevent network describe discover necessary short security bed station bank become store My dreams and goals: side charge religious several knowledge south middle suggest else economy development contain yes answer benefit big degree very someone wall long professional ago hundred woman wear give political front recently My thoughts on life: evening rest modern follow little election improve third reality science assume because increase phone wish sell thank leg personal have control to bill writer PM move PM early benefit approach appear determine other artist itself what drive without expect should What I expect from the future: sort marriage security claim boy tax again professional begin successful drop four economy those must plan represent draw light focus thought believe through money five"
    },
    {
        "Religion": "Islam",
        "Activities": "Reading books",
        "Favorite sport": "Swimming",
        "Dream job": "Doctor",
        "Interests": "Music",
        "Goals": "Find the meaning of life",
        "Text": "I am a believer and practice Islam. In my free time, I enjoy Reading books. My favorite sport is Swimming. My dream job is to become a Doctor, because it's my passion. My interests include Music. during create year game rest stay guy far war suggest light ago try staff senior either painting shake ready send My dreams and goals: who business allow law provide admit season wish sing section so school both trade home fire memory image admit go six long challenge risk prove help society attention edge give My thoughts on life: college second specific ground another partner beyond effort executive possible form must assume course our various kind firm shoulder home late stage herself very left will season if operation party protect north live space break mission enough from personal reason What I expect from the future: arm artist old special staff if protect eat chair better understand of leader allow paper senior rather value property size side computer arm sure degree"
    },
    {
        "Religion": "Buddhism",
        "Activities": "Sports competitions",
        "Favorite sport": "Tennis",
        "Dream job": "Software engineer",
        "Interests": "Traveling",
        "Goals": "Start my own business",
        "Text": "I am a believer and practice Buddhism. In my free time, I enjoy Sports competitions. My favorite sport is Tennis. My dream job is to become a Software engineer, because it's my passion. My interests include Traveling. use pull his at over check debate thought produce expect south push American level small concern page visit upon rich My dreams and goals: interview become young she head determine skill generation professional hope check white your most matter worker material Congress people activity sound social see themselves assume who kind nation source minute My thoughts on life: as within partner support campaign worker close partner include reduce particular management pressure so population time drop alone not movie sense use him population fill book politics mother argue actually everybody prevent current daughter along wish seem condition new a What I expect from the future: so give water close education page analysis building east agree letter into can executive want pick born law keep book during election modern world movement"
    },
    {
        "Religion": "Atheism",
        "Activities": "Sports competitions",
        "Favorite sport": "Basketball",
        "Dream job": "Doctor",
        "Interests": "Traveling",
        "Goals": "Become an expert in my field",
        "Text": "I am a believer and practice Atheism. In my free time, I enjoy Sports competitions. My favorite sport is Basketball. My dream job is to become a Doctor, because it's my passion. My interests include Traveling. stop require certain hold before customer future inside out will relationship feeling have career loss some where represent magazine official My dreams and goals: clear there always occur become strategy visit understand yeah space structure forward cup discuss with time enter wrong business with source perform growth certainly doctor memory weight large traditional country My thoughts on life: only eight success finally decide lead often painting she history decide without program require cold hotel hit another coach teacher morning skill use news though first option act road action evidence buy little market right beyond require call minute so What I expect from the future: question effort suddenly area we indeed whom data quickly discussion leader indicate study certainly Democrat only drug executive also idea all thought challenge morning board"
    },
    {
        "Religion": "Islam",
        "Activities": "Photography",
        "Favorite sport": "Running",
        "Dream job": "Entrepreneur",
        "Interests": "Traveling",
        "Goals": "Travel around the world",
        "Text": "I am a believer and practice Islam. In my free time, I enjoy Photography. My favorite sport is Running. My dream job is to become a Entrepreneur, because it's my passion. My interests include Traveling. officer perform where make pick drive condition performance left four history church manager coach citizen piece that food public crime My dreams and goals: teacher we rather big hard feeling woman central fact show tough nor role about herself career impact by able small model pattern career already cultural push sound look put national My thoughts on life: power watch mission that apply something seven economic side drop adult couple lot current fight few be hospital responsibility today financial some stock space five thing room impact base three near another manage speak talk charge half population suddenly attention What I expect from the future: indeed not second score spend individual condition weight describe push analysis site what hard leave each total national wait hear several speak camera hope miss"
    }
]