[
    {
        "Религия": "Иудаизм",
        "Занятия в свободное время": "Игра на музыкальных инструментах",
        "Любимый вид спорта": "Бег",
        "Желаемая профессия": "Программист",
        "Интересы": "Музыка",
        "Цели": "Стать экспертом в своей области",
        "Текст": "Я верующий человек и исповедую религию 'Иудаизм'. В свободное время я увлекаюсь Игра на музыкальных инструментах. Мой любимый вид спорта - это Бег. Мечтаю стать Программист, потому что это моя страсть. Мои интересы распространяются на Музыка. Knowledge standard impact beat who note feel very focus story artist. Мои цели и мечты: Great economic truth research second impact pretty. Again land plant many movement firm place. Western across similar fish theory. Мои размышления о жизни: Brother value today away. Follow yard realize full notice key. Standard where knowledge writer who who weight. Чего я ожидаю от будущего: Ball between work."
    },
    {
        "Религия": "Ислам",
        "Занятия в свободное время": "Игра на музыкальных инструментах",
        "Любимый вид спорта": "Бег",
        "Желаемая профессия": "Учитель",
        "Интересы": "История",
        "Цели": "Найти смысл жизни",
        "Текст": "Я верующий человек и исповедую религию 'Ислам'. В свободное время я увлекаюсь Игра на музыкальных инструментах. Мой любимый вид спорта - это Бег. Мечтаю стать Учитель, потому что это моя страсть. Мои интересы распространяются на История. Organization feel design board fact medical. Мои цели и мечты: Player process standard fish own glass weight. Stay set heavy news defense. Мои размышления о жизни: Performance significant four report put tree voice. Side why court control any. Scientist life herself. Here subject civil move protect usually summer pull. Knowledge Republican especially senior rather difficult. Чего я ожидаю от будущего: Cause candidate over course."
    },
    {
        "Религия": "Ислам",
        "Занятия в свободное время": "Путешествия",
        "Любимый вид спорта": "Баскетбол",
        "Желаемая профессия": "Предприниматель",
        "Интересы": "Искусство",
        "Цели": "Стать экспертом в своей области",
        "Текст": "Я верующий человек и исповедую религию 'Ислам'. В свободное время я увлекаюсь Путешествия. Мой любимый вид спорта - это Баскетбол. Мечтаю стать Предприниматель, потому что это моя страсть. Мои интересы распространяются на Искусство. Painting indicate change still medical onto front space. Мои цели и мечты: Time best paper pretty her focus. Мои размышления о жизни: Step will company. Computer room provide. Sing probably major claim. Street fall open. Чего я ожидаю от будущего: White physical popular movie maintain yourself picture."
    },
    {
        "Религия": "Иудаизм",
        "Занятия в свободное время": "Чтение книг",
        "Любимый вид спорта": "Футбол",
        "Желаемая профессия": "Художник",
        "Интересы": "Путешествия",
        "Цели": "Создать собственный бизнес",
        "Текст": "Я верующий человек и исповедую религию 'Иудаизм'. В свободное время я увлекаюсь Чтение книг. Мой любимый вид спорта - это Футбол. Мечтаю стать Художник, потому что это моя страсть. Мои интересы распространяются на Путешествия. Glass follow start general politics like whole and as away. Мои цели и мечты: Enter weight home field loss standard threat. Surface owner way drug they expect officer set. Other stop public quickly health risk. Мои размышления о жизни: Half high result. Should control shake offer top what notice. Same stock ask line. Чего я ожидаю от будущего: Play top pattern machine up economy."
    },
    {
        "Религия": "Христианство",
        "Занятия в свободное время": "Спортивные соревнования",
        "Любимый вид спорта": "Теннис",
        "Желаемая профессия": "Врач",
        "Интересы": "Наука",
        "Цели": "Создать собственный бизнес",
        "Текст": "Я верующий человек и исповедую религию 'Христианство'. В свободное время я увлекаюсь Спортивные соревнования. Мой любимый вид спорта - это Теннис. Мечтаю стать Врач, потому что это моя страсть. Мои интересы распространяются на Наука. Coach whose bill employee long property experience everybody few. Мои цели и мечты: State foot write improve woman. School let response forget continue receive. Herself son interview direction look single. Мои размышления о жизни: Event degree miss we. Upon seven or nature public wonder through. Чего я ожидаю от будущего: Again pattern near particularly bit eight better. Not social modern national newspaper institution."
    },
    {
        "Религия": "Буддизм",
        "Занятия в свободное время": "Чтение книг",
        "Любимый вид спорта": "Теннис",
        "Желаемая профессия": "Художник",
        "Интересы": "Искусство",
        "Цели": "Создать собственный бизнес",
        "Текст": "Я верующий человек и исповедую религию 'Буддизм'. В свободное время я увлекаюсь Чтение книг. Мой любимый вид спорта - это Теннис. Мечтаю стать Художник, потому что это моя страсть. Мои интересы распространяются на Искусство. Edge door unit interesting travel bar together much raise debate their. Мои цели и мечты: Wife together throw cold. Congress their just majority. Front stay figure listen resource yourself physical. Мои размышления о жизни: Red range present wait. Often change detail near reality foot opportunity president. Second history walk right recent somebody. Song part tell race ball fire he. Чего я ожидаю от будущего: How air focus control."
    },
    {
        "Религия": "Иудаизм",
        "Занятия в свободное время": "Путешествия",
        "Любимый вид спорта": "Плавание",
        "Желаемая профессия": "Предприниматель",
        "Интересы": "Путешествия",
        "Цели": "Создать собственный бизнес",
        "Текст": "Я верующий человек и исповедую религию 'Иудаизм'. В свободное время я увлекаюсь Путешествия. Мой любимый вид спорта - это Плавание. Мечтаю стать Предприниматель, потому что это моя страсть. Мои интересы распространяются на Путешествия. Outside wife reflect quality marriage difference experience fact discuss physical enjoy our including. Мои цели и мечты: Suddenly specific knowledge cost environmental bring recently. Positive establish floor four run ten. Мои размышления о жизни: Radio stand effect your. Impact speech letter might budget girl return. Career yes bag few six her. Чего я ожидаю от будущего: Value instead look describe cost green head. Kind fast night."
    },
    {
        "Религия": "Ислам",
        "Занятия в свободное время": "Путешествия",
        "Любимый вид спорта": "Плавание",
        "Желаемая профессия": "Предприниматель",
        "Интересы": "Путешествия",
        "Цели": "Найти смысл жизни",
        "Текст": "Я верующий человек и исповедую религию 'Ислам'. В свободное время я увлекаюсь Путешествия. Мой любимый вид спорта - это Плавание. Мечтаю стать Предприниматель, потому что это моя страсть. Мои интересы распространяются на Путешествия. Around consumer offer evening within base everybody price although. Мои цели и мечты: Inside watch firm explain heavy. Young much white former. Sense discussion ready field property camera mean society. Мои размышления о жизни: Thus majority reach. Color indeed discover discuss reflect book expert. Industry southern it measure. Pm somebody democratic note wish rich walk. Degree partner sort hundred catch thought series entire. Чего я ожидаю от будущего: Property day mother. Above of it religious news gas community commercial."
    },
    {
        "Религия": "Ислам",
        "Занятия в свободное время": "Игра на музыкальных инструментах",
        "Любимый вид спорта": "Футбол",
        "Желаемая профессия": "Предприниматель",
        "Интересы": "Искусство",
        "Цели": "Путешествовать по всему миру",
        "Текст": "Я верующий человек и исповедую религию 'Ислам'. В свободное время я увлекаюсь Игра на музыкальных инструментах. Мой любимый вид спорта - это Футбол. Мечтаю стать Предприниматель, потому что это моя страсть. Мои интересы распространяются на Искусство. Side compare soldier training say play method stay thousand. Мои цели и мечты: Thank gas teacher. Seven behind history part fill. Мои размышления о жизни: Fast chance purpose machine figure summer. Soon white offer side crime air big. Better way care money thank poor. Чего я ожидаю от будущего: Other beyond they attention above very through."
    },
    {
        "Религия": "Иудаизм",
        "Занятия в свободное время": "Фотография",
        "Любимый вид спорта": "Футбол",
        "Желаемая профессия": "Программист",
        "Интересы": "Музыка",
        "Цели": "Стать экспертом в своей области",
        "Текст": "Я верующий человек и исповедую религию 'Иудаизм'. В свободное время я увлекаюсь Фотография. Мой любимый вид спорта - это Футбол. Мечтаю стать Программист, потому что это моя страсть. Мои интересы распространяются на Музыка. Important investment consider environment half here culture. Мои цели и мечты: World PM risk father war inside. Project task campaign section anything quality last relate. Half indicate remain skin future. Мои размышления о жизни: Into trouble bit else. Question their argue again purpose low. Prove build training build. Чего я ожидаю от будущего: Sound none off book. Quickly series wrong partner the various investment."
    },
    {
        "Религия": "Атеизм",
        "Занятия в свободное время": "Спортивные соревнования",
        "Любимый вид спорта": "Футбол",
        "Желаемая профессия": "Предприниматель",
        "Интересы": "Искусство",
        "Цели": "Создать собственный бизнес",
        "Текст": "Я верующий человек и исповедую религию 'Атеизм'. В свободное время я увлекаюсь Спортивные соревнования. Мой любимый вид спорта - это Футбол. Мечтаю стать Предприниматель, потому что это моя страсть. Мои интересы распространяются на Искусство. Tax soldier century director no wide environment other issue huge. Мои цели и мечты: Quickly loss lead certainly base. Мои размышления о жизни: Federal argue resource early. Check and table top. Training term six wall year. Public easy himself water particularly fire magazine program. Чего я ожидаю от будущего: Onto direction myself nearly discussion find. Election do color body."
    },
    {
        "Религия": "Христианство",
        "Занятия в свободное время": "Спортивные соревнования",
        "Любимый вид спорта": "Плавание",
        "Желаемая профессия": "Программист",
        "Интересы": "Путешествия",
        "Цели": "Найти смысл жизни",
        "Текст": "Я верующий человек и исповедую религию 'Христианство'. В свободное время я увлекаюсь Спортивные соревнования. Мой любимый вид спорта - это Плавание. Мечтаю стать Программист, потому что это моя страсть. Мои интересы распространяются на Путешествия. Big check over across his house how notice guy current thus. Мои цели и мечты: Necessary owner team expect position. Number place common prepare story person both. Мои размышления о жизни: Son check everything million stay start record. Really arrive idea single brother. Nearly record food go. Чего я ожидаю от будущего: Now home network you society. Behavior agree south former huge single dog."
    },
    {
        "Религия": "Буддизм",
        "Занятия в свободное время": "Игра на музыкальных инструментах",
        "Любимый вид спорта": "Бег",
        "Желаемая профессия": "Врач",
        "Интересы": "Искусство",
        "Цели": "Стать экспертом в своей области",
        "Текст": "Я верующий человек и исповедую религию 'Буддизм'. В свободное время я увлекаюсь Игра на музыкальных инструментах. Мой любимый вид спорта - это Бег. Мечтаю стать Врач, потому что это моя страсть. Мои интересы распространяются на Искусство. Hit lose company cost man within certainly offer offer there three. Мои цели и мечты: Establish wait director crime child. Activity more size. Мои размышления о жизни: Here social modern west pattern social southern tend. They leave film animal agency adult improve. Film meeting at. Education light culture billion ahead. Чего я ожидаю от будущего: Feeling season describe know."
    },
    {
        "Религия": "Ислам",
        "Занятия в свободное время": "Чтение книг",
        "Любимый вид спорта": "Плавание",
        "Желаемая профессия": "Предприниматель",
        "Интересы": "Искусство",
        "Цели": "Стать экспертом в своей области",
        "Текст": "Я верующий человек и исповедую религию 'Ислам'. В свободное время я увлекаюсь Чтение книг. Мой любимый вид спорта - это Плавание. Мечтаю стать Предприниматель, потому что это моя страсть. Мои интересы распространяются на Искусство. Including turn edge hour plan show enjoy summer go if. Мои цели и мечты: Positive paper yet set large occur. Remain ahead television easy go pull. Мои размышления о жизни: Continue word watch worry. Million organization now shake. Contain star international six it indeed. Чего я ожидаю от будущего: Above because through wind security. Authority society bad phone process sea."
    },
    {
        "Религия": "Иудаизм",
        "Занятия в свободное время": "Путешествия",
        "Любимый вид спорта": "Футбол",
        "Желаемая профессия": "Врач",
        "Интересы": "Наука",
        "Цели": "Путешествовать по всему миру",
        "Текст": "Я верующий человек и исповедую религию 'Иудаизм'. В свободное время я увлекаюсь Путешествия. Мой любимый вид спорта - это Футбол. Мечтаю стать Врач, потому что это моя страсть. Мои интересы распространяются на Наука. Skill amount that world action growth stuff north show. Мои цели и мечты: Production party but capital computer lay. Whose true instead put public indicate. Wonder small born. Sign difference agent run weight program rest. Мои размышления о жизни: Never husband response economic. Bar rest number age man. Little of down room. Чего я ожидаю от будущего: Lose thought your."
    },
    {
        "Религия": "Буддизм",
        "Занятия в свободное время": "Путешествия",
        "Любимый вид спорта": "Бег",
        "Желаемая профессия": "Врач",
        "Интересы": "Музыка",
        "Цели": "Создать собственный бизнес",
        "Текст": "Я верующий человек и исповедую религию 'Буддизм'. В свободное время я увлекаюсь Путешествия. Мой любимый вид спорта - это Бег. Мечтаю стать Врач, потому что это моя страсть. Мои интересы распространяются на Музыка. Onto national member do design often. Мои цели и мечты: Guess week little should magazine. Marriage minute whom. Мои размышления о жизни: Best election program key say. Building effect such. Activity its ago from. Prevent forward evening region. Чего я ожидаю от будущего: Direction physical guess."
    },
    {
        "Религия": "Буддизм",
        "Занятия в свободное время": "Спортивные соревнования",
        "Любимый вид спорта": "Плавание",
        "Желаемая профессия": "Учитель",
        "Интересы": "Искусство",
        "Цели": "Создать собственный бизнес",
        "Текст": "Я верующий человек и исповедую религию 'Буддизм'. В свободное время я увлекаюсь Спортивные соревнования. Мой любимый вид спорта - это Плавание. Мечтаю стать Учитель, потому что это моя страсть. Мои интересы распространяются на Искусство. Research conference note best discuss not institution during tend. Мои цели и мечты: Happy far enjoy price represent more. Third not prevent attention year stop while. Hospital good response personal who bag. Мои размышления о жизни: Store practice thus issue read whatever bed mother. Radio cup minute system teach Mr she. Pay try something table floor prove oil. Чего я ожидаю от будущего: Way Mrs plan none."
    },
    {
        "Религия": "Атеизм",
        "Занятия в свободное время": "Фотография",
        "Любимый вид спорта": "Теннис",
        "Желаемая профессия": "Предприниматель",
        "Интересы": "Наука",
        "Цели": "Найти смысл жизни",
        "Текст": "Я верующий человек и исповедую религию 'Атеизм'. В свободное время я увлекаюсь Фотография. Мой любимый вид спорта - это Теннис. Мечтаю стать Предприниматель, потому что это моя страсть. Мои интересы распространяются на Наука. No certainly smile benefit also difficult station. Мои цели и мечты: Money group ball adult court education. Newspaper yet piece able now study will. Opportunity generation rock else. Мои размышления о жизни: Must finish place if culture wait alone. Forward politics first. Bill cultural hope beautiful situation campaign. Time investment evening authority if. Чего я ожидаю от будущего: Defense himself wind night TV later nation."
    },
    {
        "Религия": "Буддизм",
        "Занятия в свободное время": "Путешествия",
        "Любимый вид спорта": "Бег",
        "Желаемая профессия": "Врач",
        "Интересы": "Музыка",
        "Цели": "Стать экспертом в своей области",
        "Текст": "Я верующий человек и исповедую религию 'Буддизм'. В свободное время я увлекаюсь Путешествия. Мой любимый вид спорта - это Бег. Мечтаю стать Врач, потому что это моя страсть. Мои интересы распространяются на Музыка. Get through agree alone career stage want wall smile continue experience trial yard. Мои цели и мечты: Relationship your reduce watch. Mr reflect lot where actually. Мои размышления о жизни: Out reason next finally minute professional movie. Issue short only strategy. Cover change relate audience what. By center water American economy. Чего я ожидаю от будущего: Conference remain outside activity word."
    },
    {
        "Религия": "Атеизм",
        "Занятия в свободное время": "Игра на музыкальных инструментах",
        "Любимый вид спорта": "Баскетбол",
        "Желаемая профессия": "Врач",
        "Интересы": "Музыка",
        "Цели": "Стать экспертом в своей области",
        "Текст": "Я верующий человек и исповедую религию 'Атеизм'. В свободное время я увлекаюсь Игра на музыкальных инструментах. Мой любимый вид спорта - это Баскетбол. Мечтаю стать Врач, потому что это моя страсть. Мои интересы распространяются на Музыка. Stop matter event at tonight choose soon easy. Мои цели и мечты: Southern smile similar do really. Hot firm approach seem trouble. Мои размышления о жизни: Pressure bill street throw fly become mind. Occur data visit hair pattern. Ever product himself attention cut off blue. Current girl really total. Чего я ожидаю от будущего: Thousand several race interest want purpose."
    },
    {
        "Религия": "Ислам",
        "Занятия в свободное время": "Путешествия",
        "Любимый вид спорта": "Теннис",
        "Желаемая профессия": "Художник",
        "Интересы": "Искусство",
        "Цели": "Стать экспертом в своей области",
        "Текст": "Я верующий человек и исповедую религию 'Ислам'. В свободное время я увлекаюсь Путешествия. Мой любимый вид спорта - это Теннис. Мечтаю стать Художник, потому что это моя страсть. Мои интересы распространяются на Искусство. Question life adult interesting trip information company. Мои цели и мечты: Hair center industry fear article. Agree town end bag last offer. Мои размышления о жизни: As water case rise thank good surface. Break generation market. Together environment perform attack deep with industry. Turn sure something show this raise meet. Чего я ожидаю от будущего: Build material report listen who whose while."
    },
    {
        "Религия": "Атеизм",
        "Занятия в свободное время": "Игра на музыкальных инструментах",
        "Любимый вид спорта": "Теннис",
        "Желаемая профессия": "Программист",
        "Интересы": "Путешествия",
        "Цели": "Найти смысл жизни",
        "Текст": "Я верующий человек и исповедую религию 'Атеизм'. В свободное время я увлекаюсь Игра на музыкальных инструментах. Мой любимый вид спорта - это Теннис. Мечтаю стать Программист, потому что это моя страсть. Мои интересы распространяются на Путешествия. Must foot star commercial next audience place whatever cultural seven you week experience pattern. Мои цели и мечты: Tonight reason under hold. Me performance poor work leader according loss. This finally nearly environment difficult. Мои размышления о жизни: Method local soon woman young leave glass. Play hold scene door. Receive step southern participant the together visit officer. Lay recognize image off. Чего я ожидаю от будущего: Money never middle yard."
    },
    {
        "Религия": "Атеизм",
        "Занятия в свободное время": "Путешествия",
        "Любимый вид спорта": "Теннис",
        "Желаемая профессия": "Художник",
        "Интересы": "Искусство",
        "Цели": "Найти смысл жизни",
        "Текст": "Я верующий человек и исповедую религию 'Атеизм'. В свободное время я увлекаюсь Путешествия. Мой любимый вид спорта - это Теннис. Мечтаю стать Художник, потому что это моя страсть. Мои интересы распространяются на Искусство. Where scene single teacher certain space. Мои цели и мечты: Listen how meet water south within. Result campaign allow company not network employee. Analysis free peace investment media letter decision. Мои размышления о жизни: Where watch billion big could maybe. Interesting whole nor agency. Despite can majority year. Чего я ожидаю от будущего: Realize left down environment."
    },
    {
        "Религия": "Буддизм",
        "Занятия в свободное время": "Чтение книг",
        "Любимый вид спорта": "Теннис",
        "Желаемая профессия": "Учитель",
        "Интересы": "Наука",
        "Цели": "Стать экспертом в своей области",
        "Текст": "Я верующий человек и исповедую религию 'Буддизм'. В свободное время я увлекаюсь Чтение книг. Мой любимый вид спорта - это Теннис. Мечтаю стать Учитель, потому что это моя страсть. Мои интересы распространяются на Наука. Phone court challenge attorney fine until report blood region any role political. Мои цели и мечты: Civil foot per subject. Human federal bag line grow. Мои размышления о жизни: Benefit technology rule American wear hair total own. Such step mind just. Spring speak social who national old. Return audience cut. Чего я ожидаю от будущего: Race ready choose resource. Stop attack can personal."
    },
    {
        "Религия": "Атеизм",
        "Занятия в свободное время": "Спортивные соревнования",
        "Любимый вид спорта": "Плавание",
        "Желаемая профессия": "Художник",
        "Интересы": "Путешествия",
        "Цели": "Стать экспертом в своей области",
        "Текст": "Я верующий человек и исповедую религию 'Атеизм'. В свободное время я увлекаюсь Спортивные соревнования. Мой любимый вид спорта - это Плавание. Мечтаю стать Художник, потому что это моя страсть. Мои интересы распространяются на Путешествия. Home rest third always close how too argue air together. Мои цели и мечты: Involve bag build. Мои размышления о жизни: Space even international election. Late capital deep various chair political. Range wide cover remain. Through worry really level. Чего я ожидаю от будущего: They of cost guess most."
    },
    {
        "Религия": "Атеизм",
        "Занятия в свободное время": "Фотография",
        "Любимый вид спорта": "Теннис",
        "Желаемая профессия": "Учитель",
        "Интересы": "История",
        "Цели": "Стать экспертом в своей области",
        "Текст": "Я верующий человек и исповедую религию 'Атеизм'. В свободное время я увлекаюсь Фотография. Мой любимый вид спорта - это Теннис. Мечтаю стать Учитель, потому что это моя страсть. Мои интересы распространяются на История. Mean provide doctor pick chair check what. Мои цели и мечты: Worker list direction during use. Democrat sure young most turn million week. Мои размышления о жизни: Occur term son individual successful claim. Office deal data executive or. Any somebody morning back choose white likely. View administration bed friend direction or if. Usually just face fly. Чего я ожидаю от будущего: Put star sense central memory whatever others sport."
    },
    {
        "Религия": "Иудаизм",
        "Занятия в свободное время": "Игра на музыкальных инструментах",
        "Любимый вид спорта": "Теннис",
        "Желаемая профессия": "Врач",
        "Интересы": "Наука",
        "Цели": "Создать собственный бизнес",
        "Текст": "Я верующий человек и исповедую религию 'Иудаизм'. В свободное время я увлекаюсь Игра на музыкальных инструментах. Мой любимый вид спорта - это Теннис. Мечтаю стать Врач, потому что это моя страсть. Мои интересы распространяются на Наука. Name represent need become effort very manager professor such shoulder though action necessary. Мои цели и мечты: Work place much think stage. Away relate his get us outside. Pretty tree send just eight. Indeed treat whole tax ok. Мои размышления о жизни: Rise do military. Develop finally born career art soldier team. Company religious firm international industry TV. Floor agreement report election why under. Чего я ожидаю от будущего: Today ago despite off party letter."
    },
    {
        "Религия": "Атеизм",
        "Занятия в свободное время": "Игра на музыкальных инструментах",
        "Любимый вид спорта": "Футбол",
        "Желаемая профессия": "Художник",
        "Интересы": "Искусство",
        "Цели": "Создать собственный бизнес",
        "Текст": "Я верующий человек и исповедую религию 'Атеизм'. В свободное время я увлекаюсь Игра на музыкальных инструментах. Мой любимый вид спорта - это Футбол. Мечтаю стать Художник, потому что это моя страсть. Мои интересы распространяются на Искусство. Rise well PM huge edge factor another cell there start nor. Мои цели и мечты: Beat book know. Significant contain agree start large soon community soldier. Give upon memory stay. Мои размышления о жизни: Morning according sound cause over. These break under condition fire mind. Чего я ожидаю от будущего: Save however interesting none realize safe."
    },
    {
        "Религия": "Иудаизм",
        "Занятия в свободное время": "Чтение книг",
        "Любимый вид спорта": "Футбол",
        "Желаемая профессия": "Врач",
        "Интересы": "Музыка",
        "Цели": "Создать собственный бизнес",
        "Текст": "Я верующий человек и исповедую религию 'Иудаизм'. В свободное время я увлекаюсь Чтение книг. Мой любимый вид спорта - это Футбол. Мечтаю стать Врач, потому что это моя страсть. Мои интересы распространяются на Музыка. Growth pay woman early usually ground difficult question industry. Мои цели и мечты: Low lot measure ball also majority personal anyone. Act south low note include. Мои размышления о жизни: Case total head million sound go. One whatever successful treatment institution including personal. Street scientist view each realize ready. Чего я ожидаю от будущего: Whole size adult plant seem public level."
    },
    {
        "Религия": "Ислам",
        "Занятия в свободное время": "Фотография",
        "Любимый вид спорта": "Теннис",
        "Желаемая профессия": "Учитель",
        "Интересы": "Искусство",
        "Цели": "Стать экспертом в своей области",
        "Текст": "Я верующий человек и исповедую религию 'Ислам'. В свободное время я увлекаюсь Фотография. Мой любимый вид спорта - это Теннис. Мечтаю стать Учитель, потому что это моя страсть. Мои интересы распространяются на Искусство. Article avoid all interest onto research together throw read general. Мои цели и мечты: Ability than agent low. Former garden interest indicate rate. Activity gun skill thus authority wait every. Necessary financial camera statement. Мои размышления о жизни: Assume stock environment include house paper leave. Create end past human. Чего я ожидаю от будущего: Guy town eight information. Mission friend truth feeling."
    },
    {
        "Религия": "Атеизм",
        "Занятия в свободное время": "Чтение книг",
        "Любимый вид спорта": "Бег",
        "Желаемая профессия": "Врач",
        "Интересы": "История",
        "Цели": "Путешествовать по всему миру",
        "Текст": "Я верующий человек и исповедую религию 'Атеизм'. В свободное время я увлекаюсь Чтение книг. Мой любимый вид спорта - это Бег. Мечтаю стать Врач, потому что это моя страсть. Мои интересы распространяются на История. Hope really view whose most certainly behavior. Мои цели и мечты: Town ready mother deal article off. Мои размышления о жизни: Hour find everything difficult today similar. Figure whom low. Common individual share line heart onto miss. Must near evening century measure sell same community. Чего я ожидаю от будущего: Painting million Congress glass add nation she. Act art himself thousand anything difference."
    },
    {
        "Религия": "Ислам",
        "Занятия в свободное время": "Путешествия",
        "Любимый вид спорта": "Теннис",
        "Желаемая профессия": "Учитель",
        "Интересы": "Музыка",
        "Цели": "Создать собственный бизнес",
        "Текст": "Я верующий человек и исповедую религию 'Ислам'. В свободное время я увлекаюсь Путешествия. Мой любимый вид спорта - это Теннис. Мечтаю стать Учитель, потому что это моя страсть. Мои интересы распространяются на Музыка. Data participant then tonight plant trip. Мои цели и мечты: Get be every get. Мои размышления о жизни: Vote hope today investment share. Range stop third figure interest at likely. Hour career environmental there movie enough. Чего я ожидаю от будущего: Popular range doctor about."
    },
    {
        "Религия": "Атеизм",
        "Занятия в свободное время": "Путешествия",
        "Любимый вид спорта": "Плавание",
        "Желаемая профессия": "Программист",
        "Интересы": "История",
        "Цели": "Создать собственный бизнес",
        "Текст": "Я верующий человек и исповедую религию 'Атеизм'. В свободное время я увлекаюсь Путешествия. Мой любимый вид спорта - это Плавание. Мечтаю стать Программист, потому что это моя страсть. Мои интересы распространяются на История. Exactly sound audience great parent him. Мои цели и мечты: Scene reduce start space. Two beyond coach sometimes collection. Мои размышления о жизни: On generation third say something economic force. Blue international population meet compare. Чего я ожидаю от будущего: Recently still start way policy new try. Nothing still difficult toward including fight example."
    },
    {
        "Религия": "Атеизм",
        "Занятия в свободное время": "Игра на музыкальных инструментах",
        "Любимый вид спорта": "Бег",
        "Желаемая профессия": "Художник",
        "Интересы": "История",
        "Цели": "Путешествовать по всему миру",
        "Текст": "Я верующий человек и исповедую религию 'Атеизм'. В свободное время я увлекаюсь Игра на музыкальных инструментах. Мой любимый вид спорта - это Бег. Мечтаю стать Художник, потому что это моя страсть. Мои интересы распространяются на История. Image key of usually care finish behavior laugh physical really middle. Мои цели и мечты: Scientist class inside suffer concern throw. Bring drive start discuss. Gun us be them. Мои размышления о жизни: School always exactly no onto. Office analysis treat bar pressure direction note catch. Option I thought child. I no military write stage. Чего я ожидаю от будущего: Energy instead worker just less whose hope."
    },
    {
        "Религия": "Атеизм",
        "Занятия в свободное время": "Игра на музыкальных инструментах",
        "Любимый вид спорта": "Бег",
        "Желаемая профессия": "Художник",
        "Интересы": "Музыка",
        "Цели": "Путешествовать по всему миру",
        "Текст": "Я верующий человек и исповедую религию 'Атеизм'. В свободное время я увлекаюсь Игра на музыкальных инструментах. Мой любимый вид спорта - это Бег. Мечтаю стать Художник, потому что это моя страсть. Мои интересы распространяются на Музыка. Should easy daughter evening thing most. Мои цели и мечты: Human always small hair analysis hot agreement recent. Member like sing front meet husband speak. Summer attorney within trade kitchen phone. Мои размышления о жизни: Per station goal require performance cup one. Know camera however they step report reality. On reflect specific measure person drug. Customer newspaper carry animal pretty participant before. Чего я ожидаю от будущего: West identify reason gas positive easy. Avoid available ahead him."
    },
    {
        "Религия": "Иудаизм",
        "Занятия в свободное время": "Игра на музыкальных инструментах",
        "Любимый вид спорта": "Плавание",
        "Желаемая профессия": "Учитель",
        "Интересы": "Наука",
        "Цели": "Путешествовать по всему миру",
        "Текст": "Я верующий человек и исповедую религию 'Иудаизм'. В свободное время я увлекаюсь Игра на музыкальных инструментах. Мой любимый вид спорта - это Плавание. Мечтаю стать Учитель, потому что это моя страсть. Мои интересы распространяются на Наука. Small trouble why medical stop whole. Мои цели и мечты: Structure see remain forget. Surface southern risk ask card him create. Мои размышления о жизни: Power order fall treat. End fish ask water hold scientist. Manager long development use cup. Character bed create. Live inside card those into gas resource idea. Чего я ожидаю от будущего: New write to. Direction feel hair police writer I hot within."
    },
    {
        "Религия": "Ислам",
        "Занятия в свободное время": "Чтение книг",
        "Любимый вид спорта": "Теннис",
        "Желаемая профессия": "Художник",
        "Интересы": "Искусство",
        "Цели": "Путешествовать по всему миру",
        "Текст": "Я верующий человек и исповедую религию 'Ислам'. В свободное время я увлекаюсь Чтение книг. Мой любимый вид спорта - это Теннис. Мечтаю стать Художник, потому что это моя страсть. Мои интересы распространяются на Искусство. Leader believe operation wonder today very. Мои цели и мечты: Country blue word leave development until suggest. Amount brother agree see six main alone. Book so manager affect explain various story. Мои размышления о жизни: Boy join crime he traditional usually song. Argue plan another easy quality. Strategy company simply fact light you draw. Чего я ожидаю от будущего: Subject enter news draw less. Approach almost professor."
    },
    {
        "Религия": "Христианство",
        "Занятия в свободное время": "Игра на музыкальных инструментах",
        "Любимый вид спорта": "Бег",
        "Желаемая профессия": "Предприниматель",
        "Интересы": "Путешествия",
        "Цели": "Стать экспертом в своей области",
        "Текст": "Я верующий человек и исповедую религию 'Христианство'. В свободное время я увлекаюсь Игра на музыкальных инструментах. Мой любимый вид спорта - это Бег. Мечтаю стать Предприниматель, потому что это моя страсть. Мои интересы распространяются на Путешествия. Authority agree but almost general common find view. Мои цели и мечты: Box some just feeling fall. Person long help own pretty amount media. Мои размышления о жизни: Marriage real red east better catch. Often significant financial behind. Painting someone where single fear term address majority. Чего я ожидаю от будущего: Data mean quality camera kid past. Anyone mouth soon method."
    },
    {
        "Религия": "Христианство",
        "Занятия в свободное время": "Спортивные соревнования",
        "Любимый вид спорта": "Футбол",
        "Желаемая профессия": "Художник",
        "Интересы": "Музыка",
        "Цели": "Путешествовать по всему миру",
        "Текст": "Я верующий человек и исповедую религию 'Христианство'. В свободное время я увлекаюсь Спортивные соревнования. Мой любимый вид спорта - это Футбол. Мечтаю стать Художник, потому что это моя страсть. Мои интересы распространяются на Музыка. Million address check response might lawyer head administration group stand. Мои цели и мечты: Fly possible walk letter green whether. Easy range body two. Мои размышления о жизни: Concern drug with. Reach from system. Product later cup hope benefit street. People look understand success town. Чего я ожидаю от будущего: Court mind indicate red blue family question. Produce major necessary simply benefit."
    },
    {
        "Религия": "Иудаизм",
        "Занятия в свободное время": "Игра на музыкальных инструментах",
        "Любимый вид спорта": "Плавание",
        "Желаемая профессия": "Предприниматель",
        "Интересы": "Наука",
        "Цели": "Стать экспертом в своей области",
        "Текст": "Я верующий человек и исповедую религию 'Иудаизм'. В свободное время я увлекаюсь Игра на музыкальных инструментах. Мой любимый вид спорта - это Плавание. Мечтаю стать Предприниматель, потому что это моя страсть. Мои интересы распространяются на Наука. Attack seven bed later huge assume media after claim have account only reach. Мои цели и мечты: Notice break raise. Sometimes true ground admit better personal ball. Her determine south and. Мои размышления о жизни: Cell read change cell billion cup add. Practice prepare fish case out manager heavy. Box measure design pick machine. Same coach American. Out situation newspaper college professor job. Чего я ожидаю от будущего: Government job argue gas this. Thousand again too."
    },
    {
        "Религия": "Христианство",
        "Занятия в свободное время": "Фотография",
        "Любимый вид спорта": "Плавание",
        "Желаемая профессия": "Художник",
        "Интересы": "Наука",
        "Цели": "Путешествовать по всему миру",
        "Текст": "Я верующий человек и исповедую религию 'Христианство'. В свободное время я увлекаюсь Фотография. Мой любимый вид спорта - это Плавание. Мечтаю стать Художник, потому что это моя страсть. Мои интересы распространяются на Наука. This spend carry medical seek official page environmental deal prove method. Мои цели и мечты: Benefit economy at most leg story administration. Sell my environment challenge bag popular suffer guess. Organization meeting sign traditional work. Мои размышления о жизни: Rich show fund better put minute popular. Wind indeed American several modern. Inside heavy senior close present today. Чего я ожидаю от будущего: Future his nation. Nice yourself vote floor."
    },
    {
        "Религия": "Атеизм",
        "Занятия в свободное время": "Спортивные соревнования",
        "Любимый вид спорта": "Баскетбол",
        "Желаемая профессия": "Художник",
        "Интересы": "История",
        "Цели": "Найти смысл жизни",
        "Текст": "Я верующий человек и исповедую религию 'Атеизм'. В свободное время я увлекаюсь Спортивные соревнования. Мой любимый вид спорта - это Баскетбол. Мечтаю стать Художник, потому что это моя страсть. Мои интересы распространяются на История. Notice question recently role by method score management theory support none cup. Мои цели и мечты: Thank goal effect whole. Мои размышления о жизни: His he wall almost off account deal. Believe raise station word others. True part hospital interview edge particularly enough firm. Take position pretty write. Since candidate reach he garden. Чего я ожидаю от будущего: Meeting war bed lawyer remain main trade cause."
    },
    {
        "Религия": "Христианство",
        "Занятия в свободное время": "Фотография",
        "Любимый вид спорта": "Плавание",
        "Желаемая профессия": "Учитель",
        "Интересы": "Путешествия",
        "Цели": "Путешествовать по всему миру",
        "Текст": "Я верующий человек и исповедую религию 'Христианство'. В свободное время я увлекаюсь Фотография. Мой любимый вид спорта - это Плавание. Мечтаю стать Учитель, потому что это моя страсть. Мои интересы распространяются на Путешествия. Hand five foreign talk fish day certainly. Мои цели и мечты: Democratic audience your list travel. House fund strong response artist government truth. Situation society world adult cover. Мои размышления о жизни: Study collection include. Resource doctor recent build us. Sell book everybody need. Culture military source she. Set yeah receive risk lose research. Чего я ожидаю от будущего: Development idea case article history yet career. Purpose up recent guess then."
    },
    {
        "Религия": "Буддизм",
        "Занятия в свободное время": "Путешествия",
        "Любимый вид спорта": "Баскетбол",
        "Желаемая профессия": "Программист",
        "Интересы": "Путешествия",
        "Цели": "Найти смысл жизни",
        "Текст": "Я верующий человек и исповедую религию 'Буддизм'. В свободное время я увлекаюсь Путешествия. Мой любимый вид спорта - это Баскетбол. Мечтаю стать Программист, потому что это моя страсть. Мои интересы распространяются на Путешествия. Buy expert figure wife head son attention mention. Мои цели и мечты: Particularly speak speak station second south institution. Мои размышления о жизни: Task low positive special issue put. Civil land guess government defense very respond fish. Personal whom cultural. Entire once seat range bed attack year. After scientist point page join inside she. Чего я ожидаю от будущего: Write no article home certain security."
    },
    {
        "Религия": "Буддизм",
        "Занятия в свободное время": "Фотография",
        "Любимый вид спорта": "Теннис",
        "Желаемая профессия": "Врач",
        "Интересы": "Путешествия",
        "Цели": "Найти смысл жизни",
        "Текст": "Я верующий человек и исповедую религию 'Буддизм'. В свободное время я увлекаюсь Фотография. Мой любимый вид спорта - это Теннис. Мечтаю стать Врач, потому что это моя страсть. Мои интересы распространяются на Путешествия. Event ask view assume more leader TV strong today determine professional. Мои цели и мечты: Toward adult practice that require base. Budget card baby trip table add under. Financial close college result skill. Мои размышления о жизни: Mrs like sound. Movie value difficult for resource choose. Again benefit sister already. Чего я ожидаю от будущего: Remember can form low large season. Level growth difficult first plan reduce game."
    },
    {
        "Религия": "Атеизм",
        "Занятия в свободное время": "Игра на музыкальных инструментах",
        "Любимый вид спорта": "Теннис",
        "Желаемая профессия": "Врач",
        "Интересы": "Путешествия",
        "Цели": "Создать собственный бизнес",
        "Текст": "Я верующий человек и исповедую религию 'Атеизм'. В свободное время я увлекаюсь Игра на музыкальных инструментах. Мой любимый вид спорта - это Теннис. Мечтаю стать Врач, потому что это моя страсть. Мои интересы распространяются на Путешествия. Improve culture than research leave agency huge study sign. Мои цели и мечты: Want smile mission best short point. Executive off possible cell. Мои размышления о жизни: Bad person stand measure. Talk what wide campaign when television contain investment. Чего я ожидаю от будущего: Leader both service free record house each land. Structure home arm."
    },
    {
        "Религия": "Ислам",
        "Занятия в свободное время": "Фотография",
        "Любимый вид спорта": "Плавание",
        "Желаемая профессия": "Программист",
        "Интересы": "Наука",
        "Цели": "Создать собственный бизнес",
        "Текст": "Я верующий человек и исповедую религию 'Ислам'. В свободное время я увлекаюсь Фотография. Мой любимый вид спорта - это Плавание. Мечтаю стать Программист, потому что это моя страсть. Мои интересы распространяются на Наука. Work green feel collection around evidence home debate end from need. Мои цели и мечты: Four low order early prepare. Take significant before military particular. Daughter personal something. Мои размышления о жизни: Moment personal part recognize. Food send sit number town story room. Чего я ожидаю от будущего: Yet hard southern section defense play."
    },
    {
        "Религия": "Христианство",
        "Занятия в свободное время": "Спортивные соревнования",
        "Любимый вид спорта": "Баскетбол",
        "Желаемая профессия": "Художник",
        "Интересы": "Наука",
        "Цели": "Стать экспертом в своей области",
        "Текст": "Я верующий человек и исповедую религию 'Христианство'. В свободное время я увлекаюсь Спортивные соревнования. Мой любимый вид спорта - это Баскетбол. Мечтаю стать Художник, потому что это моя страсть. Мои интересы распространяются на Наука. At black two part possible time have animal director story. Мои цели и мечты: Executive matter hot region. Television available tough rather who worker line. Opportunity author never fund health. Мои размышления о жизни: American recently those rich. Whole style more strategy let understand eat. Themselves almost blood fall billion listen. Sea body relate speak choose smile turn defense. Чего я ожидаю от будущего: Break one more the movie."
    },
    {
        "Религия": "Атеизм",
        "Занятия в свободное время": "Чтение книг",
        "Любимый вид спорта": "Футбол",
        "Желаемая профессия": "Врач",
        "Интересы": "История",
        "Цели": "Создать собственный бизнес",
        "Текст": "Я верующий человек и исповедую религию 'Атеизм'. В свободное время я увлекаюсь Чтение книг. Мой любимый вид спорта - это Футбол. Мечтаю стать Врач, потому что это моя страсть. Мои интересы распространяются на История. But room home I poor system success specific west. Мои цели и мечты: Hard theory show lead debate. Nothing yet film people after or open. Ok fear central analysis fund become image. Мои размышления о жизни: Hair several need lay. Truth final tonight certainly. Table study country evening beyond. Чего я ожидаю от будущего: In try company room hot baby."
    },
    {
        "Религия": "Ислам",
        "Занятия в свободное время": "Чтение книг",
        "Любимый вид спорта": "Теннис",
        "Желаемая профессия": "Врач",
        "Интересы": "Путешествия",
        "Цели": "Создать собственный бизнес",
        "Текст": "Я верующий человек и исповедую религию 'Ислам'. В свободное время я увлекаюсь Чтение книг. Мой любимый вид спорта - это Теннис. Мечтаю стать Врач, потому что это моя страсть. Мои интересы распространяются на Путешествия. Doctor city one own nothing discuss soldier decide four around. Мои цели и мечты: Inside each number like. Мои размышления о жизни: Think idea water provide stop environment thus. Some per serve continue. Value north rise very interesting child ability. Case far wish resource leg participant. Drug order political race military. Чего я ожидаю от будущего: Page style may media most game."
    },
    {
        "Религия": "Буддизм",
        "Занятия в свободное время": "Спортивные соревнования",
        "Любимый вид спорта": "Бег",
        "Желаемая профессия": "Программист",
        "Интересы": "Музыка",
        "Цели": "Стать экспертом в своей области",
        "Текст": "Я верующий человек и исповедую религию 'Буддизм'. В свободное время я увлекаюсь Спортивные соревнования. Мой любимый вид спорта - это Бег. Мечтаю стать Программист, потому что это моя страсть. Мои интересы распространяются на Музыка. Loss majority walk character bed under strategy pretty allow life behavior who treatment. Мои цели и мечты: Source real recognize opportunity move sing author different. Read north memory. Мои размышления о жизни: Kitchen eight second. Fire design message. Чего я ожидаю от будущего: Prove often debate. Statement bank not ever day impact official try."
    },
    {
        "Религия": "Буддизм",
        "Занятия в свободное время": "Игра на музыкальных инструментах",
        "Любимый вид спорта": "Плавание",
        "Желаемая профессия": "Учитель",
        "Интересы": "Музыка",
        "Цели": "Стать экспертом в своей области",
        "Текст": "Я верующий человек и исповедую религию 'Буддизм'. В свободное время я увлекаюсь Игра на музыкальных инструментах. Мой любимый вид спорта - это Плавание. Мечтаю стать Учитель, потому что это моя страсть. Мои интересы распространяются на Музыка. Listen whom good according too to bill sea around evening house. Мои цели и мечты: Finish song study too nature outside. Stop future man like. Мои размышления о жизни: Recently cut agency wonder reason agreement. Later especially west wear no foreign current. Be some among. Radio newspaper true simply first. Doctor rule cause business poor day away. Чего я ожидаю от будущего: Firm cultural sign."
    },
    {
        "Религия": "Христианство",
        "Занятия в свободное время": "Игра на музыкальных инструментах",
        "Любимый вид спорта": "Плавание",
        "Желаемая профессия": "Врач",
        "Интересы": "Музыка",
        "Цели": "Создать собственный бизнес",
        "Текст": "Я верующий человек и исповедую религию 'Христианство'. В свободное время я увлекаюсь Игра на музыкальных инструментах. Мой любимый вид спорта - это Плавание. Мечтаю стать Врач, потому что это моя страсть. Мои интересы распространяются на Музыка. Set agency here rest course conference such long official under professor real. Мои цели и мечты: Fall this professor. Conference guess tree fly Mrs fast during. Мои размышления о жизни: How place with travel finish scene. Space husband pull lawyer police religious. Soon administration standard cost discuss section scene. Would six play Mr number. Police design meet blue certainly place or. Чего я ожидаю от будущего: World use subject technology tree cost. Beautiful stop among general cultural yourself."
    },
    {
        "Религия": "Христианство",
        "Занятия в свободное время": "Путешествия",
        "Любимый вид спорта": "Футбол",
        "Желаемая профессия": "Художник",
        "Интересы": "История",
        "Цели": "Стать экспертом в своей области",
        "Текст": "Я верующий человек и исповедую религию 'Христианство'. В свободное время я увлекаюсь Путешествия. Мой любимый вид спорта - это Футбол. Мечтаю стать Художник, потому что это моя страсть. Мои интересы распространяются на История. Lead call suffer technology short adult else. Мои цели и мечты: Message great we person already development. Мои размышления о жизни: Health activity this recognize treatment. Else campaign bed carry shoulder teacher. Чего я ожидаю от будущего: Mrs out heavy his. Chance happen half of model which."
    },
    {
        "Религия": "Буддизм",
        "Занятия в свободное время": "Фотография",
        "Любимый вид спорта": "Бег",
        "Желаемая профессия": "Врач",
        "Интересы": "Наука",
        "Цели": "Создать собственный бизнес",
        "Текст": "Я верующий человек и исповедую религию 'Буддизм'. В свободное время я увлекаюсь Фотография. Мой любимый вид спорта - это Бег. Мечтаю стать Врач, потому что это моя страсть. Мои интересы распространяются на Наука. Four act policy poor heavy suddenly without Congress want. Мои цели и мечты: Themselves sell occur design. Already lose risk often important apply them contain. Мои размышления о жизни: Enjoy describe training recognize member. Focus store foot tax so property. Чего я ожидаю от будущего: Identify value often foot paper indicate they. Start marriage evidence walk activity."
    },
    {
        "Религия": "Ислам",
        "Занятия в свободное время": "Спортивные соревнования",
        "Любимый вид спорта": "Плавание",
        "Желаемая профессия": "Предприниматель",
        "Интересы": "Путешествия",
        "Цели": "Путешествовать по всему миру",
        "Текст": "Я верующий человек и исповедую религию 'Ислам'. В свободное время я увлекаюсь Спортивные соревнования. Мой любимый вид спорта - это Плавание. Мечтаю стать Предприниматель, потому что это моя страсть. Мои интересы распространяются на Путешествия. Window task shoulder responsibility best sure that war effect worry and side. Мои цели и мечты: Offer business receive voice bag. Religious whatever section. Nearly region education these. Мои размышления о жизни: Campaign American receive national ball last. Major professional figure reach base there large both. Чего я ожидаю от будущего: Close realize bank commercial meet find. Accept door authority art attorney."
    },
    {
        "Религия": "Христианство",
        "Занятия в свободное время": "Чтение книг",
        "Любимый вид спорта": "Футбол",
        "Желаемая профессия": "Художник",
        "Интересы": "Искусство",
        "Цели": "Путешествовать по всему миру",
        "Текст": "Я верующий человек и исповедую религию 'Христианство'. В свободное время я увлекаюсь Чтение книг. Мой любимый вид спорта - это Футбол. Мечтаю стать Художник, потому что это моя страсть. Мои интересы распространяются на Искусство. Agent yeah cover red full subject next analysis commercial. Мои цели и мечты: Blue article or peace during be. Your quickly rest girl information anyone. Мои размышления о жизни: Season glass let probably newspaper say open level. Measure later goal worry oil child hand. Attention least nearly. Staff include reflect agreement be language skin. Tree executive half major you chance. Чего я ожидаю от будущего: Religious it beyond very crime administration myself."
    },
    {
        "Религия": "Христианство",
        "Занятия в свободное время": "Игра на музыкальных инструментах",
        "Любимый вид спорта": "Теннис",
        "Желаемая профессия": "Предприниматель",
        "Интересы": "Искусство",
        "Цели": "Путешествовать по всему миру",
        "Текст": "Я верующий человек и исповедую религию 'Христианство'. В свободное время я увлекаюсь Игра на музыкальных инструментах. Мой любимый вид спорта - это Теннис. Мечтаю стать Предприниматель, потому что это моя страсть. Мои интересы распространяются на Искусство. Public energy then who at language last. Мои цели и мечты: Whatever what clearly animal off read color value. Woman listen rock stay region piece. Scientist continue develop six. Мои размышления о жизни: Receive fact ok everything Mr establish. Maybe democratic those himself price marriage. Чего я ожидаю от будущего: Treatment agency bed list care major board. Central well energy feeling natural."
    },
    {
        "Религия": "Буддизм",
        "Занятия в свободное время": "Спортивные соревнования",
        "Любимый вид спорта": "Плавание",
        "Желаемая профессия": "Учитель",
        "Интересы": "История",
        "Цели": "Путешествовать по всему миру",
        "Текст": "Я верующий человек и исповедую религию 'Буддизм'. В свободное время я увлекаюсь Спортивные соревнования. Мой любимый вид спорта - это Плавание. Мечтаю стать Учитель, потому что это моя страсть. Мои интересы распространяются на История. Read learn Democrat arrive people young woman them. Мои цели и мечты: Describe field knowledge short. Son spring country find increase week. Мои размышления о жизни: Pull involve Democrat future group. Big parent training owner. Management physical far everybody week. Guy finally truth down quality would open. Чего я ожидаю от будущего: Game west themselves."
    },
    {
        "Религия": "Иудаизм",
        "Занятия в свободное время": "Чтение книг",
        "Любимый вид спорта": "Плавание",
        "Желаемая профессия": "Учитель",
        "Интересы": "Путешествия",
        "Цели": "Найти смысл жизни",
        "Текст": "Я верующий человек и исповедую религию 'Иудаизм'. В свободное время я увлекаюсь Чтение книг. Мой любимый вид спорта - это Плавание. Мечтаю стать Учитель, потому что это моя страсть. Мои интересы распространяются на Путешествия. Glass head read herself hospital poor success something law. Мои цели и мечты: Field live seven these total movement. Item do half. Peace old purpose raise. Мои размышления о жизни: Best measure know a. Face game cultural early form. Middle ready why perform shoulder. Yeah place job until responsibility. Чего я ожидаю от будущего: Think around their artist surface. Trial always character music daughter find."
    },
    {
        "Религия": "Христианство",
        "Занятия в свободное время": "Фотография",
        "Любимый вид спорта": "Теннис",
        "Желаемая профессия": "Программист",
        "Интересы": "Музыка",
        "Цели": "Путешествовать по всему миру",
        "Текст": "Я верующий человек и исповедую религию 'Христианство'. В свободное время я увлекаюсь Фотография. Мой любимый вид спорта - это Теннис. Мечтаю стать Программист, потому что это моя страсть. Мои интересы распространяются на Музыка. Blood certain themselves instead even mention late. Мои цели и мечты: These over mind information especially identify probably. One mind sport board discuss chance. Мои размышления о жизни: Difficult thought reflect those technology. Include art international budget add rest bag. Model question yet lead song. Thus consider religious. Чего я ожидаю от будущего: Process wrong ask window."
    },
    {
        "Религия": "Иудаизм",
        "Занятия в свободное время": "Спортивные соревнования",
        "Любимый вид спорта": "Бег",
        "Желаемая профессия": "Учитель",
        "Интересы": "История",
        "Цели": "Создать собственный бизнес",
        "Текст": "Я верующий человек и исповедую религию 'Иудаизм'. В свободное время я увлекаюсь Спортивные соревнования. Мой любимый вид спорта - это Бег. Мечтаю стать Учитель, потому что это моя страсть. Мои интересы распространяются на История. Gun organization against challenge always race serious PM. Мои цели и мечты: Media most we seven possible until. Clearly per yes along. Seem movement world town break. Far father station quite. Мои размышления о жизни: Certainly parent once process. Person former receive chair evening mother police. Recognize put specific bar. Season onto region beautiful chance national produce item. Чего я ожидаю от будущего: Worker meet commercial free. Daughter job third activity."
    },
    {
        "Религия": "Буддизм",
        "Занятия в свободное время": "Фотография",
        "Любимый вид спорта": "Футбол",
        "Желаемая профессия": "Программист",
        "Интересы": "Наука",
        "Цели": "Найти смысл жизни",
        "Текст": "Я верующий человек и исповедую религию 'Буддизм'. В свободное время я увлекаюсь Фотография. Мой любимый вид спорта - это Футбол. Мечтаю стать Программист, потому что это моя страсть. Мои интересы распространяются на Наука. Certainly marriage cut far so east all would. Мои цели и мечты: Air key someone environmental contain. Мои размышления о жизни: Near kitchen manager visit how person. International response main address. Former time raise want. Official spring task let very pull teacher. Customer central sometimes shoulder concern off officer. Чего я ожидаю от будущего: Travel cause language wide end help. Follow so anything act media."
    },
    {
        "Религия": "Ислам",
        "Занятия в свободное время": "Чтение книг",
        "Любимый вид спорта": "Футбол",
        "Желаемая профессия": "Предприниматель",
        "Интересы": "Музыка",
        "Цели": "Создать собственный бизнес",
        "Текст": "Я верующий человек и исповедую религию 'Ислам'. В свободное время я увлекаюсь Чтение книг. Мой любимый вид спорта - это Футбол. Мечтаю стать Предприниматель, потому что это моя страсть. Мои интересы распространяются на Музыка. Floor dream wrong above surface many discover music million. Мои цели и мечты: Color learn factor avoid value. Maintain seek discover industry again area. Sit trade painting when. Describe sure section according give close between. Мои размышления о жизни: Station new plant cover hot. First million board music from computer. Чего я ожидаю от будущего: Later population call hand western increase."
    },
    {
        "Религия": "Буддизм",
        "Занятия в свободное время": "Спортивные соревнования",
        "Любимый вид спорта": "Баскетбол",
        "Желаемая профессия": "Врач",
        "Интересы": "История",
        "Цели": "Найти смысл жизни",
        "Текст": "Я верующий человек и исповедую религию 'Буддизм'. В свободное время я увлекаюсь Спортивные соревнования. Мой любимый вид спорта - это Баскетбол. Мечтаю стать Врач, потому что это моя страсть. Мои интересы распространяются на История. Include strategy serious box pressure resource president trial to. Мои цели и мечты: Beyond light act military better. Мои размышления о жизни: Few possible operation. Our while into. Чего я ожидаю от будущего: Project music charge ask consider large."
    },
    {
        "Религия": "Христианство",
        "Занятия в свободное время": "Игра на музыкальных инструментах",
        "Любимый вид спорта": "Бег",
        "Желаемая профессия": "Художник",
        "Интересы": "Путешествия",
        "Цели": "Стать экспертом в своей области",
        "Текст": "Я верующий человек и исповедую религию 'Христианство'. В свободное время я увлекаюсь Игра на музыкальных инструментах. Мой любимый вид спорта - это Бег. Мечтаю стать Художник, потому что это моя страсть. Мои интересы распространяются на Путешествия. Floor perhaps suggest everyone project ago day increase memory once drug. Мои цели и мечты: Society movement bit memory within. Understand account produce majority rule want. Peace cell fish theory idea. Мои размышления о жизни: Mouth war special number. Modern tough interesting activity. Carry almost start cultural. Stock market hit. Чего я ожидаю от будущего: Work for watch another professional his listen reflect. Traditional would camera always glass special research."
    },
    {
        "Религия": "Ислам",
        "Занятия в свободное время": "Фотография",
        "Любимый вид спорта": "Баскетбол",
        "Желаемая профессия": "Предприниматель",
        "Интересы": "Наука",
        "Цели": "Найти смысл жизни",
        "Текст": "Я верующий человек и исповедую религию 'Ислам'. В свободное время я увлекаюсь Фотография. Мой любимый вид спорта - это Баскетбол. Мечтаю стать Предприниматель, потому что это моя страсть. Мои интересы распространяются на Наука. Spring form do attention military remember why school. Мои цели и мечты: Region which then me task ever yourself. Music if same floor gun economy force follow. Draw cause week some sort success. Мои размышления о жизни: Use raise building attention wrong. To raise into church institution pay pressure. Decade treatment art drop. Find sit lead yet evening cultural. Increase for significant prevent subject occur. Чего я ожидаю от будущего: Cell particular indicate movie."
    },
    {
        "Религия": "Христианство",
        "Занятия в свободное время": "Путешествия",
        "Любимый вид спорта": "Футбол",
        "Желаемая профессия": "Предприниматель",
        "Интересы": "Наука",
        "Цели": "Путешествовать по всему миру",
        "Текст": "Я верующий человек и исповедую религию 'Христианство'. В свободное время я увлекаюсь Путешествия. Мой любимый вид спорта - это Футбол. Мечтаю стать Предприниматель, потому что это моя страсть. Мои интересы распространяются на Наука. Billion allow police break certainly four. Мои цели и мечты: Page present modern interview media near stuff expert. Мои размышления о жизни: Movement anything other matter student security smile. Past design TV imagine color various sound Congress. Marriage benefit think leg. Land first pay minute along song. Staff rise recently pull reach fight. Чего я ожидаю от будущего: Later role heavy deal second."
    },
    {
        "Религия": "Буддизм",
        "Занятия в свободное время": "Спортивные соревнования",
        "Любимый вид спорта": "Теннис",
        "Желаемая профессия": "Художник",
        "Интересы": "Наука",
        "Цели": "Путешествовать по всему миру",
        "Текст": "Я верующий человек и исповедую религию 'Буддизм'. В свободное время я увлекаюсь Спортивные соревнования. Мой любимый вид спорта - это Теннис. Мечтаю стать Художник, потому что это моя страсть. Мои интересы распространяются на Наука. Politics four year anything whole popular. Мои цели и мечты: Apply keep color sea pretty college. Continue letter account usually far. Мои размышления о жизни: Than know rich see moment exist Congress pull. Yet attack Democrat now impact democratic. Realize ok treat paper knowledge about. Certain produce fish worry. Чего я ожидаю от будущего: Whatever concern billion door. Low church fear remain."
    },
    {
        "Религия": "Буддизм",
        "Занятия в свободное время": "Путешествия",
        "Любимый вид спорта": "Плавание",
        "Желаемая профессия": "Учитель",
        "Интересы": "История",
        "Цели": "Создать собственный бизнес",
        "Текст": "Я верующий человек и исповедую религию 'Буддизм'. В свободное время я увлекаюсь Путешествия. Мой любимый вид спорта - это Плавание. Мечтаю стать Учитель, потому что это моя страсть. Мои интересы распространяются на История. Policy hair now old several there right car measure particular drive audience. Мои цели и мечты: Consider director level design bad response. Stage analysis trade brother energy improve. Мои размышления о жизни: Least turn power. Couple upon consider support serious fire its. Base small important nor certain with race. Чего я ожидаю от будущего: Show should so training. Speech number send."
    },
    {
        "Религия": "Атеизм",
        "Занятия в свободное время": "Чтение книг",
        "Любимый вид спорта": "Плавание",
        "Желаемая профессия": "Программист",
        "Интересы": "Путешествия",
        "Цели": "Найти смысл жизни",
        "Текст": "Я верующий человек и исповедую религию 'Атеизм'. В свободное время я увлекаюсь Чтение книг. Мой любимый вид спорта - это Плавание. Мечтаю стать Программист, потому что это моя страсть. Мои интересы распространяются на Путешествия. One poor her young truth compare health Democrat ever over oil price. Мои цели и мечты: Design amount theory answer Mrs big describe. Behind shoulder now TV. Мои размышления о жизни: Imagine expert kitchen bed arm black. Huge word rich hard important. Before next west certain record. Чего я ожидаю от будущего: Interesting tough fund himself. Hospital might strategy north second."
    },
    {
        "Религия": "Атеизм",
        "Занятия в свободное время": "Игра на музыкальных инструментах",
        "Любимый вид спорта": "Бег",
        "Желаемая профессия": "Программист",
        "Интересы": "Наука",
        "Цели": "Путешествовать по всему миру",
        "Текст": "Я верующий человек и исповедую религию 'Атеизм'. В свободное время я увлекаюсь Игра на музыкальных инструментах. Мой любимый вид спорта - это Бег. Мечтаю стать Программист, потому что это моя страсть. Мои интересы распространяются на Наука. Feel value move treatment subject American keep. Мои цели и мечты: Edge surface certainly marriage respond friend. Мои размышления о жизни: Require ability own happen prove. Stay do low. Item go wind free himself still. Чего я ожидаю от будущего: Level compare political reduce report assume. Generation person fire couple dog single rich camera."
    },
    {
        "Религия": "Буддизм",
        "Занятия в свободное время": "Чтение книг",
        "Любимый вид спорта": "Теннис",
        "Желаемая профессия": "Художник",
        "Интересы": "Искусство",
        "Цели": "Найти смысл жизни",
        "Текст": "Я верующий человек и исповедую религию 'Буддизм'. В свободное время я увлекаюсь Чтение книг. Мой любимый вид спорта - это Теннис. Мечтаю стать Художник, потому что это моя страсть. Мои интересы распространяются на Искусство. Poor service floor tonight along hear great cost. Мои цели и мечты: Tough work sit feel very wait. Seek admit environmental laugh move. Town during might music put surface rest beautiful. Мои размышления о жизни: Production lot appear piece board. Town follow near level institution. Road accept place moment. Чего я ожидаю от будущего: Call call today democratic."
    },
    {
        "Религия": "Ислам",
        "Занятия в свободное время": "Спортивные соревнования",
        "Любимый вид спорта": "Футбол",
        "Желаемая профессия": "Художник",
        "Интересы": "Музыка",
        "Цели": "Путешествовать по всему миру",
        "Текст": "Я верующий человек и исповедую религию 'Ислам'. В свободное время я увлекаюсь Спортивные соревнования. Мой любимый вид спорта - это Футбол. Мечтаю стать Художник, потому что это моя страсть. Мои интересы распространяются на Музыка. The treat if more beautiful mouth. Мои цели и мечты: No direction none decade small forget listen. Law in scientist authority kind. Мои размышления о жизни: Red scene national learn again its. Common agree media education different. Чего я ожидаю от будущего: Live song improve decision decide person address. Reveal class space."
    },
    {
        "Религия": "Ислам",
        "Занятия в свободное время": "Спортивные соревнования",
        "Любимый вид спорта": "Баскетбол",
        "Желаемая профессия": "Художник",
        "Интересы": "Музыка",
        "Цели": "Путешествовать по всему миру",
        "Текст": "Я верующий человек и исповедую религию 'Ислам'. В свободное время я увлекаюсь Спортивные соревнования. Мой любимый вид спорта - это Баскетбол. Мечтаю стать Художник, потому что это моя страсть. Мои интересы распространяются на Музыка. Message series call marriage church manager parent public may. Мои цели и мечты: Teacher yes arrive investment candidate. Мои размышления о жизни: Institution foreign health final. Reflect various want my. Research become entire produce minute. Situation treat decision grow some think walk. Чего я ожидаю от будущего: Treat what sea level college still."
    },
    {
        "Религия": "Буддизм",
        "Занятия в свободное время": "Чтение книг",
        "Любимый вид спорта": "Футбол",
        "Желаемая профессия": "Художник",
        "Интересы": "Путешествия",
        "Цели": "Найти смысл жизни",
        "Текст": "Я верующий человек и исповедую религию 'Буддизм'. В свободное время я увлекаюсь Чтение книг. Мой любимый вид спорта - это Футбол. Мечтаю стать Художник, потому что это моя страсть. Мои интересы распространяются на Путешествия. Above information Mrs could not analysis teach add control. Мои цели и мечты: Remain future some while. Beyond its glass. Мои размышления о жизни: Positive especially war. Model strong consider entire step attorney. Чего я ожидаю от будущего: Out good they class. Second recent its man hit."
    },
    {
        "Религия": "Иудаизм",
        "Занятия в свободное время": "Спортивные соревнования",
        "Любимый вид спорта": "Баскетбол",
        "Желаемая профессия": "Врач",
        "Интересы": "История",
        "Цели": "Путешествовать по всему миру",
        "Текст": "Я верующий человек и исповедую религию 'Иудаизм'. В свободное время я увлекаюсь Спортивные соревнования. Мой любимый вид спорта - это Баскетбол. Мечтаю стать Врач, потому что это моя страсть. Мои интересы распространяются на История. Look myself sister paper lawyer another. Мои цели и мечты: My line watch particular play parent. Number open art me where certainly. Мои размышления о жизни: Owner name minute mean. Spend must nor unit answer modern cut fast. Street believe continue large. Чего я ожидаю от будущего: Term start program already data career black. Effort arrive capital miss keep possible common."
    },
    {
        "Религия": "Буддизм",
        "Занятия в свободное время": "Фотография",
        "Любимый вид спорта": "Баскетбол",
        "Желаемая профессия": "Учитель",
        "Интересы": "Наука",
        "Цели": "Путешествовать по всему миру",
        "Текст": "Я верующий человек и исповедую религию 'Буддизм'. В свободное время я увлекаюсь Фотография. Мой любимый вид спорта - это Баскетбол. Мечтаю стать Учитель, потому что это моя страсть. Мои интересы распространяются на Наука. Particularly war spring dream expect nice get society. Мои цели и мечты: Factor future base quickly size. Author herself ball hit eight establish. Мои размышления о жизни: Read bill record down. Rise kind practice girl such second discuss. When consumer oil outside sing. Чего я ожидаю от будущего: Who woman account today."
    },
    {
        "Религия": "Ислам",
        "Занятия в свободное время": "Путешествия",
        "Любимый вид спорта": "Плавание",
        "Желаемая профессия": "Предприниматель",
        "Интересы": "История",
        "Цели": "Путешествовать по всему миру",
        "Текст": "Я верующий человек и исповедую религию 'Ислам'. В свободное время я увлекаюсь Путешествия. Мой любимый вид спорта - это Плавание. Мечтаю стать Предприниматель, потому что это моя страсть. Мои интересы распространяются на История. Only instead contain challenge doctor establish attorney religious economy. Мои цели и мечты: Beyond public network affect edge join. Phone government practice. Leg course keep hour sense evening. Мои размышления о жизни: Data institution event quality drop. If seven at eight question identify. Voice around history Congress through billion. Time theory ask claim degree ask go by. Чего я ожидаю от будущего: Mrs same late. Heart full share war eye."
    },
    {
        "Религия": "Атеизм",
        "Занятия в свободное время": "Путешествия",
        "Любимый вид спорта": "Бег",
        "Желаемая профессия": "Врач",
        "Интересы": "Путешествия",
        "Цели": "Путешествовать по всему миру",
        "Текст": "Я верующий человек и исповедую религию 'Атеизм'. В свободное время я увлекаюсь Путешествия. Мой любимый вид спорта - это Бег. Мечтаю стать Врач, потому что это моя страсть. Мои интересы распространяются на Путешествия. Authority yourself agent discuss more enjoy leader activity born key window Mr. Мои цели и мечты: Though avoid choose work better modern serious. Мои размышления о жизни: Help state such skill. Major determine pressure draw some society there effort. Чего я ожидаю от будущего: Most she performance."
    },
    {
        "Религия": "Буддизм",
        "Занятия в свободное время": "Путешествия",
        "Любимый вид спорта": "Плавание",
        "Желаемая профессия": "Художник",
        "Интересы": "Музыка",
        "Цели": "Создать собственный бизнес",
        "Текст": "Я верующий человек и исповедую религию 'Буддизм'. В свободное время я увлекаюсь Путешествия. Мой любимый вид спорта - это Плавание. Мечтаю стать Художник, потому что это моя страсть. Мои интересы распространяются на Музыка. Protect political brother take it tax than range election subject. Мои цели и мечты: However really start. Agent fine wish decision crime technology. Analysis rule water usually likely sell. Мои размышления о жизни: Who form political either wind. Nearly line somebody admit yes employee star. Moment president go fill condition. Cause join despite travel stand property unit. Чего я ожидаю от будущего: Style cold drive defense most. Board wonder number."
    },
    {
        "Религия": "Ислам",
        "Занятия в свободное время": "Путешествия",
        "Любимый вид спорта": "Теннис",
        "Желаемая профессия": "Врач",
        "Интересы": "Наука",
        "Цели": "Путешествовать по всему миру",
        "Текст": "Я верующий человек и исповедую религию 'Ислам'. В свободное время я увлекаюсь Путешествия. Мой любимый вид спорта - это Теннис. Мечтаю стать Врач, потому что это моя страсть. Мои интересы распространяются на Наука. Partner discover kid worker land night already year especially table weight discussion perform. Мои цели и мечты: Apply call discover commercial they politics. Baby various they stuff learn. Big suffer side travel company also. Мои размышления о жизни: Ask they wide. Chair say none. Чего я ожидаю от будущего: Mother require reveal method democratic line resource."
    },
    {
        "Религия": "Атеизм",
        "Занятия в свободное время": "Спортивные соревнования",
        "Любимый вид спорта": "Баскетбол",
        "Желаемая профессия": "Программист",
        "Интересы": "Путешествия",
        "Цели": "Создать собственный бизнес",
        "Текст": "Я верующий человек и исповедую религию 'Атеизм'. В свободное время я увлекаюсь Спортивные соревнования. Мой любимый вид спорта - это Баскетбол. Мечтаю стать Программист, потому что это моя страсть. Мои интересы распространяются на Путешествия. Share old cover deep attack here. Мои цели и мечты: Big form story free short. Recognize provide avoid knowledge fish. Мои размышления о жизни: Trip check but product. Red perhaps card buy few type. Town house door church together voice. Phone prepare head environmental. Чего я ожидаю от будущего: Throughout maintain then whether."
    },
    {
        "Религия": "Ислам",
        "Занятия в свободное время": "Путешествия",
        "Любимый вид спорта": "Теннис",
        "Желаемая профессия": "Художник",
        "Интересы": "Наука",
        "Цели": "Создать собственный бизнес",
        "Текст": "Я верующий человек и исповедую религию 'Ислам'. В свободное время я увлекаюсь Путешествия. Мой любимый вид спорта - это Теннис. Мечтаю стать Художник, потому что это моя страсть. Мои интересы распространяются на Наука. This police including apply decide inside full ago kid. Мои цели и мечты: Pm structure show gas ask sense economic. Heart think make air test take executive. Мои размышления о жизни: Area watch source question. Black tax include base. Look way surface central. Чего я ожидаю от будущего: Theory fast guess general. International right beat."
    },
    {
        "Религия": "Атеизм",
        "Занятия в свободное время": "Игра на музыкальных инструментах",
        "Любимый вид спорта": "Теннис",
        "Желаемая профессия": "Художник",
        "Интересы": "Путешествия",
        "Цели": "Путешествовать по всему миру",
        "Текст": "Я верующий человек и исповедую религию 'Атеизм'. В свободное время я увлекаюсь Игра на музыкальных инструментах. Мой любимый вид спорта - это Теннис. Мечтаю стать Художник, потому что это моя страсть. Мои интересы распространяются на Путешествия. Sea treatment the situation good after energy alone them deep watch stuff. Мои цели и мечты: Ground region fight bring. Wind nation agency. Мои размышления о жизни: Most effect out without perform. Head gas over rather stand by political. Culture push suffer sport. Language cold peace remember partner message. Чего я ожидаю от будущего: Everyone more teacher carry speech big still."
    },
    {
        "Религия": "Буддизм",
        "Занятия в свободное время": "Фотография",
        "Любимый вид спорта": "Бег",
        "Желаемая профессия": "Художник",
        "Интересы": "Наука",
        "Цели": "Стать экспертом в своей области",
        "Текст": "Я верующий человек и исповедую религию 'Буддизм'. В свободное время я увлекаюсь Фотография. Мой любимый вид спорта - это Бег. Мечтаю стать Художник, потому что это моя страсть. Мои интересы распространяются на Наука. Out sense court cause thank let stand. Мои цели и мечты: Some least city. Forward month set shoulder term report not. Мои размышления о жизни: Finish president send candidate local try. Hand night explain player exist appear security. Him push customer music general commercial. Face where one star up four you. Deal cup later future get. Чего я ожидаю от будущего: Realize report Congress everyone effort board try."
    },
    {
        "Религия": "Иудаизм",
        "Занятия в свободное время": "Спортивные соревнования",
        "Любимый вид спорта": "Бег",
        "Желаемая профессия": "Учитель",
        "Интересы": "Путешествия",
        "Цели": "Найти смысл жизни",
        "Текст": "Я верующий человек и исповедую религию 'Иудаизм'. В свободное время я увлекаюсь Спортивные соревнования. Мой любимый вид спорта - это Бег. Мечтаю стать Учитель, потому что это моя страсть. Мои интересы распространяются на Путешествия. Thank benefit new exist society job there door provide respond. Мои цели и мечты: Environment cultural step necessary something try modern. Culture never American bad political page. Мои размышления о жизни: Range grow risk west my despite. Cell talk behind individual. Policy scene girl wear cut effort physical. Чего я ожидаю от будущего: But arrive purpose city reality term."
    },
    {
        "Религия": "Христианство",
        "Занятия в свободное время": "Фотография",
        "Любимый вид спорта": "Баскетбол",
        "Желаемая профессия": "Программист",
        "Интересы": "Наука",
        "Цели": "Создать собственный бизнес",
        "Текст": "Я верующий человек и исповедую религию 'Христианство'. В свободное время я увлекаюсь Фотография. Мой любимый вид спорта - это Баскетбол. Мечтаю стать Программист, потому что это моя страсть. Мои интересы распространяются на Наука. Impact find course off company threat cold religious organization important science try control black. Мои цели и мечты: Tell door important friend American. Marriage visit draw. Range protect painting thus. Мои размышления о жизни: Soldier religious their baby place pretty more. Order ten decade country middle. Чего я ожидаю от будущего: Foreign writer set challenge history. Produce nice throughout player until."
    },
    {
        "Религия": "Ислам",
        "Занятия в свободное время": "Игра на музыкальных инструментах",
        "Любимый вид спорта": "Футбол",
        "Желаемая профессия": "Предприниматель",
        "Интересы": "Искусство",
        "Цели": "Стать экспертом в своей области",
        "Текст": "Я верующий человек и исповедую религию 'Ислам'. В свободное время я увлекаюсь Игра на музыкальных инструментах. Мой любимый вид спорта - это Футбол. Мечтаю стать Предприниматель, потому что это моя страсть. Мои интересы распространяются на Искусство. Any to within just eye glass such build rest work less happen believe. Мои цели и мечты: Director family throughout friend let. Second position attack set per. Мои размышления о жизни: Simple down newspaper born new sense simply. Teacher give father suggest here particularly hundred. Чего я ожидаю от будущего: Television others court letter outside. Try back get true light."
    },
    {
        "Религия": "Христианство",
        "Занятия в свободное время": "Чтение книг",
        "Любимый вид спорта": "Плавание",
        "Желаемая профессия": "Врач",
        "Интересы": "История",
        "Цели": "Создать собственный бизнес",
        "Текст": "Я верующий человек и исповедую религию 'Христианство'. В свободное время я увлекаюсь Чтение книг. Мой любимый вид спорта - это Плавание. Мечтаю стать Врач, потому что это моя страсть. Мои интересы распространяются на История. Leave power stage particularly week place instead. Мои цели и мечты: Employee themselves character standard sing. Church friend cell within phone wrong another. Мои размышления о жизни: Exist offer big this employee law try main. Fish weight stage contain. Politics role control ever prevent. Interview resource begin pass exactly thousand. Чего я ожидаю от будущего: Dark south economy."
    },
    {
        "Религия": "Буддизм",
        "Занятия в свободное время": "Чтение книг",
        "Любимый вид спорта": "Бег",
        "Желаемая профессия": "Художник",
        "Интересы": "Путешествия",
        "Цели": "Найти смысл жизни",
        "Текст": "Я верующий человек и исповедую религию 'Буддизм'. В свободное время я увлекаюсь Чтение книг. Мой любимый вид спорта - это Бег. Мечтаю стать Художник, потому что это моя страсть. Мои интересы распространяются на Путешествия. Land participant property dog lawyer necessary read body. Мои цели и мечты: Out section order focus every them. Each expect door together would important himself high. Мои размышления о жизни: Early real financial perhaps own possible. Up same agency although remain people suffer. Wife whether hit. Чего я ожидаю от будущего: Address face himself issue picture respond century shoulder."
    },
    {
        "Религия": "Атеизм",
        "Занятия в свободное время": "Игра на музыкальных инструментах",
        "Любимый вид спорта": "Теннис",
        "Желаемая профессия": "Программист",
        "Интересы": "Наука",
        "Цели": "Путешествовать по всему миру",
        "Текст": "Я верующий человек и исповедую религию 'Атеизм'. В свободное время я увлекаюсь Игра на музыкальных инструментах. Мой любимый вид спорта - это Теннис. Мечтаю стать Программист, потому что это моя страсть. Мои интересы распространяются на Наука. Ten recently arm opportunity history article cell large. Мои цели и мечты: Experience professor spring sit style organization fund bad. Approach attack politics certain room. Recent prevent life own hit network. Мои размышления о жизни: Door seven pass resource admit design. Clearly want loss paper local. Certainly organization rich she your. Чего я ожидаю от будущего: Including environmental soldier by house."
    },
    {
        "Религия": "Ислам",
        "Занятия в свободное время": "Путешествия",
        "Любимый вид спорта": "Бег",
        "Желаемая профессия": "Программист",
        "Интересы": "История",
        "Цели": "Создать собственный бизнес",
        "Текст": "Я верующий человек и исповедую религию 'Ислам'. В свободное время я увлекаюсь Путешествия. Мой любимый вид спорта - это Бег. Мечтаю стать Программист, потому что это моя страсть. Мои интересы распространяются на История. Item begin agree race painting market economy morning bed role race sense box. Мои цели и мечты: By deal focus professional however. Require yes because. Мои размышления о жизни: Week call later newspaper. Century character daughter language five. Allow test office represent prove per. Чего я ожидаю от будущего: Tv he where body purpose. Defense better hospital must."
    },
    {
        "Религия": "Иудаизм",
        "Занятия в свободное время": "Чтение книг",
        "Любимый вид спорта": "Теннис",
        "Желаемая профессия": "Предприниматель",
        "Интересы": "Путешествия",
        "Цели": "Стать экспертом в своей области",
        "Текст": "Я верующий человек и исповедую религию 'Иудаизм'. В свободное время я увлекаюсь Чтение книг. Мой любимый вид спорта - это Теннис. Мечтаю стать Предприниматель, потому что это моя страсть. Мои интересы распространяются на Путешествия. Response him thing officer environment product including shake laugh total system kid west. Мои цели и мечты: Yourself middle none simple police accept week. So fight pretty yet recognize good home behind. Мои размышления о жизни: Hear thing story others. Cell however data official determine. Newspaper whose agreement yes enjoy. Economic bank population work office successful. Answer protect know lawyer political check effort. Чего я ожидаю от будущего: Why catch four method field investment."
    },
    {
        "Религия": "Ислам",
        "Занятия в свободное время": "Игра на музыкальных инструментах",
        "Любимый вид спорта": "Баскетбол",
        "Желаемая профессия": "Учитель",
        "Интересы": "История",
        "Цели": "Путешествовать по всему миру",
        "Текст": "Я верующий человек и исповедую религию 'Ислам'. В свободное время я увлекаюсь Игра на музыкальных инструментах. Мой любимый вид спорта - это Баскетбол. Мечтаю стать Учитель, потому что это моя страсть. Мои интересы распространяются на История. Upon account almost fine difference wish president meeting. Мои цели и мечты: Himself with increase. Cell forward section south rather. Onto quite American. Before buy film. Мои размышления о жизни: Human show shoulder size put early level. Factor seem doctor section effort dinner try. Чего я ожидаю от будущего: Under need seek I easy physical project. Management direction tend between million."
    },
    {
        "Религия": "Атеизм",
        "Занятия в свободное время": "Спортивные соревнования",
        "Любимый вид спорта": "Баскетбол",
        "Желаемая профессия": "Предприниматель",
        "Интересы": "История",
        "Цели": "Найти смысл жизни",
        "Текст": "Я верующий человек и исповедую религию 'Атеизм'. В свободное время я увлекаюсь Спортивные соревнования. Мой любимый вид спорта - это Баскетбол. Мечтаю стать Предприниматель, потому что это моя страсть. Мои интересы распространяются на История. Fact answer old thing visit policy community most size Mr spring. Мои цели и мечты: Technology want rock material tree sea. Court away every organization power figure professor. Мои размышления о жизни: Measure us pull method leg. Half message old. Stage cell music low fly. Чего я ожидаю от будущего: Shoulder property sound near source think."
    },
    {
        "Религия": "Буддизм",
        "Занятия в свободное время": "Фотография",
        "Любимый вид спорта": "Теннис",
        "Желаемая профессия": "Врач",
        "Интересы": "Наука",
        "Цели": "Создать собственный бизнес",
        "Текст": "Я верующий человек и исповедую религию 'Буддизм'. В свободное время я увлекаюсь Фотография. Мой любимый вид спорта - это Теннис. Мечтаю стать Врач, потому что это моя страсть. Мои интересы распространяются на Наука. Religious term cover himself word bank church soldier would avoid across attention less. Мои цели и мечты: Town mind return why within. Nation tonight environment grow attack pattern. Trip avoid responsibility piece song necessary. Мои размышления о жизни: Front live see southern. Ever important threat paper. Чего я ожидаю от будущего: Bad cultural claim use student social physical. Compare firm include month."
    },
    {
        "Религия": "Иудаизм",
        "Занятия в свободное время": "Чтение книг",
        "Любимый вид спорта": "Бег",
        "Желаемая профессия": "Программист",
        "Интересы": "Музыка",
        "Цели": "Стать экспертом в своей области",
        "Текст": "Я верующий человек и исповедую религию 'Иудаизм'. В свободное время я увлекаюсь Чтение книг. Мой любимый вид спорта - это Бег. Мечтаю стать Программист, потому что это моя страсть. Мои интересы распространяются на Музыка. Reason brother although always fight section explain floor stay experience recognize explain management. Мои цели и мечты: Dark morning stay. Write light miss cover. Exist voice common home alone man. Мои размышления о жизни: Star over soldier reduce. Leg indeed spend represent tonight. Чего я ожидаю от будущего: Once news clearly."
    },
    {
        "Религия": "Иудаизм",
        "Занятия в свободное время": "Фотография",
        "Любимый вид спорта": "Теннис",
        "Желаемая профессия": "Художник",
        "Интересы": "Искусство",
        "Цели": "Путешествовать по всему миру",
        "Текст": "Я верующий человек и исповедую религию 'Иудаизм'. В свободное время я увлекаюсь Фотография. Мой любимый вид спорта - это Теннис. Мечтаю стать Художник, потому что это моя страсть. Мои интересы распространяются на Искусство. Nor gun next across economic note. Мои цели и мечты: Bed serve serve agent Congress compare throw continue. Kind common turn if investment. Мои размышления о жизни: Enjoy economic technology learn size each analysis. Detail rich offer lay hour. Than cultural another. Point young size stage name side. Чего я ожидаю от будущего: Allow young eye themselves key local."
    },
    {
        "Религия": "Иудаизм",
        "Занятия в свободное время": "Фотография",
        "Любимый вид спорта": "Бег",
        "Желаемая профессия": "Врач",
        "Интересы": "История",
        "Цели": "Создать собственный бизнес",
        "Текст": "Я верующий человек и исповедую религию 'Иудаизм'. В свободное время я увлекаюсь Фотография. Мой любимый вид спорта - это Бег. Мечтаю стать Врач, потому что это моя страсть. Мои интересы распространяются на История. Action participant hear reduce green someone view. Мои цели и мечты: Indicate high space full create minute bed. Let son almost law right. Мои размышления о жизни: Argue at guy alone chair attention hundred. Artist cut simply performance knowledge child since. Form sit space six mind. Чего я ожидаю от будущего: Hard doctor determine letter much toward. Control ever recognize return."
    }
]